cleaned_text,timestamp,days_elapsed
"apple's revamped iphone se to kickstart pivotal year amid challenges - apple  ( nasdaq:aapl )  apple gears up for a pivotal year with a redesigned iphone se aiming to recapture market share. new iphone se set to boast a larger screen and apple's in-house cellular modem at a competitive price point. next: access our new, shockingly simple 'alert system' apple inc.",2025-02-09,43
"prediction: this unstoppable vanguard etf could smash the s&p 500 in 2025 the s&p 500 ( snpindex: ^gspc ) has performed remarkably well in recent years, soaring by around 23% in 2024 alone and by more than 80% over the past five years.but as strong as those figures are, plenty of stocks and funds have crushed the s&p 500 lately.there's no way to know for certain how ...",2025-02-09,43
"pixar-style robots, iphone se updates, applecare+ price hike, spring 2025 lineup, and more: this week in appleverse - apple  ( nasdaq:aapl )  as we wrap up another week, it's time to look back at the tech giant, apple inc. aapl's, latest developments. from unveiling a pixar-style robot prototype to preparing for the launch of a new iphone se, apple has been making significant strides in innovation and product updates.",2025-02-09,43
"the smartest disney investors are keeping an eye on this 1 massive development walt disney ( nyse: dis ) reported better-than-expected financial results for its fiscal 2025 first quarter ( ended dec. 28, 2024 ) . revenue and diluted earnings per share were up 5% and 35%, respectively.the headline numbers get all the attention.",2025-02-09,43
"1 unstoppable cryptocurrency to buy before it soars 3,800%, according to cathie wood bitcoin ( crypto: btc ) has a market capitalization of about $1.9 trillion as of this writing. it represents more than half of the total value of all cryptocurrencies in circulation, which currently stands at $3.2 trillion.",2025-02-09,43
"best stock to buy right now: siriusxm vs. apple apple ( nasdaq: aapl ) and siriusxm ( nasdaq: siri ) aren't exactly peers. one is a technology behemoth with its hands in everything from artificial intelligence to smartphones and wearable tech. the other is solely betting on its streaming audio subscription services.sure, they both offer a ...",2025-02-08,44
"2 monster stocks to hold for the next 5 years one of the best ways to make money in the stock market is by buying and holding solid companies for the long run, as this strategy not only allows investors to take advantage of secular or disruptive trends, but also helps them benefit from the power of compounding.for instance, an investment of ...",2025-02-08,44
"if you bought 1 share of apple at its ipo, here's how many shares you would own now apple ( nasdaq: aapl ) has been a public company for more than 44 years. it's had a lot of twists and turns since, including the firing and rehiring of founder steve jobs. the company's struggles in the 1990s even led to some investors doubting the company's survival. those days are long gone, ...",2025-02-08,44
"apple stock jumps on artificial intelligence  ( ai )  driving iphone sales. here's why it's not getting crushed by the deepseek launch. as nvidia stock went down, apple stock went up.",2025-02-08,44
"gaming market size to grow by usd 100.8 billion from 2025-2029, driven by ar and vr adoption, with a report on ai's impact on market trends - technavio new york, feb. 7, 2025 /prnewswire/ -- report on how ai is redefining market landscape - the global gaming market size is estimated to grow by usd 100.8 billion from 2025-2029, according to technavio. the market is estimated to grow at a cagr of 8.4% during the forecast period.",2025-02-08,44
"could buying apple stock today set you up for life? as of this writing, apple ( nasdaq: aapl ) carries a gargantuan market cap of $3.4 trillion. this not only rivals the gdp figures of some large nations, but it makes the consumer technology business the world's most valuable enterprise.apple has surely made its early investors wealthy, as the ...",2025-02-07,45
"broadcom's trillion-dollar run: analyst expects asic to take 10%-15% market share backed by ai compute demand - broadcom  ( nasdaq:avgo )  broadcom joins the trillion-dollar club with a 634% stock surge in 5 years, driven by ai chip demand and strong semiconductor growth. ai boom fuels broadcom's revenue surge, hitting $51.6b in 2024, with ai revenue up 220% to $12.2b and a major role in future ai chip develop",2025-02-07,45
"it's time to sell apple stock. here's why. while many people still own apple ( nasdaq: aapl ) stock, i think it's time to let it go. the stock has been a stellar performer over the past decade, but all of its recent gains have been due to investors bidding up the stock, rather than actual business performance.apple produced some very ...",2025-02-07,45
"music market to grow by usd 184.69 billion  ( 2025-2029 ) , boosted by growing digital music adoption, ai driving market transformation - technavio new york, feb. 7, 2025 /prnewswire/ -- report with the ai impact on market trends - the global music market size is estimated to grow by usd 184.69 billion from 2025-2029, according to technavio. the market is estimated to grow at a cagr of 18.1% during the forecast period.",2025-02-07,45
"video game market to grow by usd 111.7 billion  ( 2025-2029 ) , boosted by smartphone penetration and better internet access, ai driving market transformation - technavio new york, feb. 7, 2025 /prnewswire/ -- report with the ai impact on market trends - the global video game market size is estimated to grow by usd 111.7 billion from 2025-2029, according to technavio. the market is estimated to grow at a cagr of 8.6% during the forecast period.",2025-02-07,45
warren buffett has two-thirds of berkshire hathaway's $297 billion portfolio invested in 5 magnificent stocks almost $195 billion of berkshire's invested assets can be traced to five of buffett's top investing ideas.,2025-02-07,45
"alphabet's verily sells granular insurance to elevance health amid healthcare strategy refocus - apple  ( nasdaq:aapl ) , elevance health  ( nyse:elv )  verily, alphabet inc.'s googl goog health technology subsidiary, announced thursday it will sell its stop-loss insurance business, granular insurance company, to elevance health elv. the deal marks another strategic pivot for the alphabet unit as it refocuses its healthcare initiatives.",2025-02-07,45
"gaming market to grow by usd 100.8 billion from 2025-2029, driven by rising ar and vr adoption, with ai redefining the market landscape - technavio new york, feb. 7, 2025 /prnewswire/ -- report with market evolution powered by ai - the global gaming market size is estimated to grow by usd 100.8 billion from 2025-2029, according to technavio. the market is estimated to grow at a cagr of 8.4% during the forecast period.",2025-02-07,45
"music production software market to grow by usd 432.8 million  ( 2025-2029 ) , boosted by rising number of musicians and artists, ai redefining market landscape - technavio new york, feb. 6, 2025 /prnewswire/ -- report with market evolution powered by ai - the global music production software market size is estimated to grow by usd 432.8 million from 2025-2029, according to technavio. the market is estimated to grow at a cagr of almost 7.7% during the forecast ...",2025-02-07,45
"skyworks hits roadblock with apple content loss, analysts see tough road for recovery - skyworks solutions  ( nasdaq:swks )  skyworks downgraded by analyst after losing apple content, with 20-25% reduction expected in iphone 17, impacting revenue till fy26. analysts see slow recovery for skyworks, with android growth offsetting apple decline, but competition and 5g risks persist long-term.",2025-02-06,46
5 sector etfs walk a tightrope amid trade tensions these sectors and their related stocks and etfs could be under the spotlight amid the escalating trade tensions.,2025-02-06,46
"sonos beats revenue targets despite dip sonos reported mixed first-quarter fiscal 2025 results, with revenue and earnings per share beating expectations despite revenue falling year over year.",2025-02-06,46
"qualcomm posts record revenue as analysts flag huawei, tariff risks - qualcomm  ( nasdaq:qcom )  qualcomm reported revenues of $11.7b, above consensus of $10.9b, driven by robust qct performance. the company guided to flat qtl revenue growth, exerting pressure on the stock. now open: 200 charter memberships to benzinga trade alerts",2025-02-06,46
"jamf stock: apple adoption, rule of 40 could unlock 29% upside, says jpmorgan - jamf holding  ( nasdaq:jamf )  jpmorgan sees 29% upside for jamf stock as apple enterprise adoption grows and valuation re-rates. jamf's rule of 40 potential and security-driven growth could drive a significant earnings rebound. next: access our new, shockingly simple 'alert system'",2025-02-06,46
"disney's streaming profits grow in q1: how to play the stock dis' streaming success signals strong potential, but near-term headwinds suggest patience, indicating investors to hold the stock as the transformation unfolds in 2025.",2025-02-06,46
"should investors change their artificial intelligence  ( ai )  investment strategy after the deepseek launch? artificial intelligence ( ai ) has been center stage for the past few years and has driven recent gains in the stock market. eight out of the nine most valuable companies in the world are directly or indirectly investing in ai programs, and these companies also account for a large amount of the ...",2025-02-06,46
should ishares s&p 500 growth etf  ( ivw )  be on your investing radar? style box etf report for ...,2025-02-06,46
got 10 years and $1000? these 3 artificial intelligence  ( ai )  stocks are set to soar. investing with a longer time horizon empowers investors to zoom out and focus on the big picture. these companies are poised to thrive over the next decade.,2025-02-06,46
"deepseek's ai model drives surge in chinese tech stocks, closing gap with us 'magnificent seven' - apple  ( nasdaq:aapl ) , amazon.com  ( nasdaq:amzn )  chinese technology stocks are witnessing a surge, spearheaded by deepseek, thereby closing the valuation gap with the u.s. 'magnificent seven.' what happened: the hang seng tech index, which includes major players like tencent holdings tcehy, alibaba group holding baba and xiaomi, neared a ...",2025-02-06,46
"online gaming market to grow by usd 120.2 million  ( 2025-2029 )  with rising popularity of e-sports boosting the market, report on ai impact on market trends - technavio new york, feb. 6, 2025 /prnewswire/ -- report on how ai is redefining market landscape - the global online gaming market size is estimated to grow by usd 120.2 million from 2025-2029, according to technavio. the market is estimated to grow at a cagr of 18.8% during the forecast period.",2025-02-06,46
"music production software market to grow by usd 432.8 million by 2029, rising musicians and artists boost market, report on how ai is driving transformation - technavio new york, feb. 5, 2025 /prnewswire/ -- report with the ai impact on market trends - the global music production software market size is estimated to grow by usd 432.8 million from 2025-2029, according to technavio. the market is estimated to grow at a cagr of almost 7.7% during the forecast ...",2025-02-06,46
"television market to grow by usd 73.1 billion by 2029, product innovation, portfolio extension, and premiumization boost market, ai-driven report - technavio new york, feb. 5, 2025 /prnewswire/ -- report with market evolution powered by ai - the global television market size is estimated to grow by usd 73.1 billion from 2025-2029, according to technavio. the market is estimated to grow at a cagr of over 8.2% during the forecast period.",2025-02-06,46
"sitime surpasses earnings expectations sitime reports a strong financial performance for the fourth quarter of 2024, surpassing analyst expectations in revenue and earnings.",2025-02-06,46
"$100 invested in this stock 5 years ago would be worth this much today - apple  ( nasdaq:aapl )  apple aapl has outperformed the market over the past 5 years by 11.31% on an annualized basis producing an average annual return of 23.81%. currently, apple has a market capitalization of $3.49 trillion.",2025-02-05,47
"spotify analyst draws comparison to apple on scale, pricing - spotify technology  ( nyse:spot )  spotify's q4 revenue grew 16% to $4.53b, beating estimates, as analysts raised price targets despite a slight eps miss. analysts expect spotify's subscriber growth, pricing power, and margin expansion to drive long-term profitability and shareholder value.",2025-02-05,47
apple stock is sliding wednesday: what's driving the action? - apple  ( nasdaq:aapl )  china's state administration for market regulation is looking into apple's app store policies and fees. the news comes amid rising trade tensions between the u.s. and china. brand new membership level: benzinga trade alerts apple inc aapl shares are trading lower wednesday.,2025-02-05,47
"hive digital technologies acquires paraguay bitcoin mining site, targets 317% hashrate growth by september 2025 - hive digital technologies  ( nasdaq:hive ) , apple  ( nasdaq:aapl )  hive digital technologies hive is setting a tone of robust expansion for this year. the company, which is in the midst of relocating its headquarters from vancouver, canada to san antonio, texas, focuses on two white-hot market segments. high-performance computing ( hpc ) and bitcoin mining.",2025-02-05,47
"prediction: nvidia stock is going to soar after feb. 26 nvidia ( nasdaq: nvda ) has gotten off to a bad start on the stock market in 2025, losing more than 10% of its value as of this writing, with chinese artificial intelligence ( ai ) start-up deepseek's launch of a low-cost but capable ai model playing a key role in the semiconductor giant's ...",2025-02-05,47
should you invest in the ishares u.s. technology etf  ( iyw ) ? sector etf report for ...,2025-02-05,47
1 wall street analyst thinks apple stock is going to $260. is it a buy? apple ( nasdaq: aapl ) is a stock that has frequently delivered for its shareholders and is set to continue doing so deeper into 2025. this is the view of one analyst tracking the stock who feels it's poised for a double-digit increase in price.his latest take on the company reflected a generally ...,2025-02-05,47
"apple raises monthly applecare+ prices for all iphones- and you can no longer buy the warranty upfront in stores - apple  ( nasdaq:aapl )  apple inc. aapl has increased the monthly subscription cost for its applecare+ service across all iphone models in the u.s. what happened: apple has raised the monthly fee for applecare+ by 50 cents. the standard applecare+ for the iphone 16 now costs $10.49 per month, up from $9.99, reported ...",2025-02-05,47
"match group beats eps, but revenue slips the online dating app giant delivered mixed results, outpacing analysts' estimates but falling short of management's revenue guidance.",2025-02-04,48
"cirrus logic outperforms on revenue, eps cirrus logic surpassed earnings expectations for q3 fy25, driven by robust revenue and cost discipline.",2025-02-04,48
"hyundai champions the joy of driving in ""play for the car"" campaign featuring the 2025 sonata hybrid - hyundai motor  ( otc:hymtf )  hyundai's latest product marketing campaign, created with culture brands, celebrates connection and sustainability with the 2025 sonata hybrid directed by nate edwards, the campaign highlights the sonata hybrid's sleek design, luxury features, and advanced technology",2025-02-04,48
"apple's app store booms as chatgpt, productivity apps drive revenue growth, analyst says - apple  ( nasdaq:aapl )  bofa's wamsi mohan maintains a buy on apple as app store revenue jumps 17% so far in q2 ( after 36 days ) . apple's app store revenue diversification accelerates, with gaming now 51% of total sales as other categories see strong monetization growth",2025-02-04,48
"behind the scenes of apple's latest options trends - apple  ( nasdaq:aapl )  deep-pocketed investors have adopted a bearish approach towards apple aapl, and it's something market players shouldn't ignore. our tracking of public options records at benzinga unveiled this significant move today.",2025-02-04,48
"apple will probably lose its market cap crown in 2025 the consumer tech giant is on top with its $3.4 trillion market cap, but this is a painful game of thrones.",2025-02-04,48
"trump's tariffs hit tsla hard, shares fall 5%: what's next? tesla becomes one of the s&p 500's worst performers after trump announces tariffs on imports from mexico, canada and china. is this a buying opportunity?",2025-02-04,48
"deepseek disrupts, big tech responds the market was left with more questions than answers about the next era of artificial intelligence. as we wait, the hyperscalers keep spending.",2025-02-04,48
"is tsla stock worth betting on now on musk's big ai promises? musk is betting big on ai, avs and optimus, believing they'll make tesla the world's most valuable company. but should you buy the stock on his optimism?",2025-02-04,48
"chip equipment maker applied materials stock is up over 9% ytd even as charts point to bearish patterns: here's what investors should look at - applied mat  ( nasdaq:amat ) , apple  ( nasdaq:aapl )  shares of applied materials inc. amat have risen by 9.11% this year despite last week's declines in semiconductor-linked companies fueled by the emergence of deepseek's v3 chatbot. here's what the company's technical and fundamental metrics reveal.",2025-02-04,48
"where will apple stock be in 3 years? apple ( nasdaq: aapl ) started 2025 on a downbeat note as shares of the technology giant headed south for most of january, but the fiscal 2025 first-quarter results it released on jan. 30 could help turn its fortunes around.for the period, which ended dec. 28, 2024, apple's revenue increased 4% ...",2025-02-04,48
"24% of warren buffett-led berkshire hathaway's $303 billion portfolio is invested in only 1 stock berkshire hathaway has compounded shareholder capital at nearly 20% annually since the 1960s. such a fantastic track record means the conglomerate is doing something right. and investors take notice.it all comes down to capital allocation, something the great warren buffett, longtime ceo of ...",2025-02-04,48
"should apple investors worry about falling iphone sales or stick with the stock? apple ( nasdaq: aapl ) reported fiscal 2025 first-quarter earnings last week that topped analyst estimates but also contained some disappointing metrics. share prices rose on the news, although the company reported a small year-over-year decline in iphone sales for the quarter.",2025-02-04,48
"got $100 per month? 3 magnificent growth etfs to buy now and hold forever. investing in exchange-traded funds ( etfs ) can be a smart alternative to buying individual stocks, as they often require less effort while offering greater diversification.growth etfs, specifically, aim to outperform the market over time.",2025-02-04,48
"stock market news for feb 4, 2025 u.s. stock markets closed lower on monday despite a recovery in the last trading session intraday.",2025-02-04,48
"gaming market to grow by usd 100.8 billion from 2025-2029, growing adoption of ar and vr games boost the market, report on how ai is driving market transformation - technavio new york, feb. 4, 2025 /prnewswire/ -- report with the ai impact on market trends - the global gaming market size is estimated to grow by usd 100.8 billion from 2025-2029, according to technavio. the market is estimated to grow at a cagr of 8.4% during the forecast period.",2025-02-04,48
"nvidia, tsmc stocks fell as trump hit mexico, canada, and china with tariffs-but top analyst sees only 'limited' supply chain impact on chips - apple  ( nasdaq:aapl ) , broadcom  ( nasdaq:avgo )  tech stocks tumbled on monday after president donald trump imposed steep tariffs on imports from canada, china, and mexico, sparking fears of supply chain disruptions - yet wedbush analyst dan ives says nvidia corporation nvda and taiwan semiconductor mfg. co. ltd. tsm won't face immediate fallout.",2025-02-04,48
"why did apple and meta platforms rise while nvidia fell 17% in 1 day? jan. 27 was a wild day in the stock market as investors reacted to chinese start-up deepseek's r1 ""reasoning"" model that competes with openai's o1 model.semiconductor stocks nvidia ( nasdaq: nvda ) , broadcom, and taiwan semiconductor manufacturing -- which constitute over $5 trillion in ...",2025-02-04,48
"should investors buy the post earnings dip in apple stock? amid heightened market volatility, investors may notice apple's (aapl) stock has dipped nearly 5% since reporting very favorable results for its fiscal first quarter last thursday.",2025-02-03,49
"apple shares are falling today: what's going on? - apple  ( nasdaq:aapl )  apple shares fall 3.12% after u.s. tariffs on chinese goods raise concerns over supply chain disruptions and rising costs. trump's new tariffs on china, mexico, and canada could lead to higher prices for consumer goods. apple inc.",2025-02-03,49
"elon's trump alignment costs him canada starlink contract: 'oh well' - t-mobile us  ( nasdaq:tmus ) , apple  ( nasdaq:aapl )  doug ford cancels starlink's $100m contract, citing u.s. tariffs on canada. opposition leaders argue the contract should never have been signed. get the real story behind every major earnings report",2025-02-03,49
"stocks trim losses on mexico tariff delay, gold extends records, tesla sinks 6%: what's driving markets monday? - apple  ( nasdaq:aapl )  the temporary tariff reprieve on mexico fuels speculation that trump may be using tariffs as negotiation tool. trump is set to speak with canadian prime minister justin trudeau at 3 p.m. et. get wall street's hottest chart every morning",2025-02-03,49
"apple may face limited tariff impact, trump administration could ease doj pressure: bofa - apple  ( nasdaq:aapl )  bofa's wamsi mohan maintains a buy on apple with a $265 target, citing strong iphone upgrades and higher services revenue. apple may ramp up india production as u.s. tariffs hit china imports, limiting earnings impact if iphone pricing stays unchanged.",2025-02-03,49
"meta bets big on future of smart glasses and ai, outspends apple and amazon on ar/vr - meta platforms  ( nasdaq:meta )  meta's investment in vr and ar set to surpass $100 billion in 2025, zuckerberg calls smart glasses a key focus meta boosts reality labs spending past $20b in 2025, aims to cut reliance on apple and google devices get the real story behind every major earnings report",2025-02-03,49
"why beer, tequila, avocados, cars, iphone prices could rise: trump's tariffs on canada, mexico, china to hurt several sectors - apple  ( nasdaq:aapl ) , mission produce  ( nasdaq:avo )  trump's tariff plans on canada, china and mexico could cause higher prices on several different sectors. a look at the sectors and stocks that could be hit the hardest. get wall street's hottest chart every morning",2025-02-03,49
"stock market news for feb 3, 2025 u.s. stocks closed lower on friday after the white house announced that president donald trump would impose stiff 25% tariffs on canadian and mexican goods and a 10% tariff on chinese goods on saturday, sparking fears of another trade war.",2025-02-03,49
"apple inc.  ( aapl )  is attracting investor attention: here is what you should know zacks.com users have recently been watching apple (aapl) quite a bit. thus, it is worth knowing the facts that could determine the stock's prospects.",2025-02-03,49
"anglogold ashanti and halliburton have been highlighted as zacks bull and bear of the day chicago, il - february 3, 2025 - zacks equity research shares anglogold ashanti plc ( au quick quoteau - ) as the bull of the day and halliburton co. ( hal quick quotehal - ) as the bear of the day.",2025-02-03,49
"billionaire ray dalio raises valuation concerns as deepseek's new model hits nvidia stock: 'a great company that gets expensive is much worse than a bad company that's really cheap' - nvidia  ( nasdaq:nvda ) , apple  ( nasdaq:aapl )  billionaire investor ray dalio prefers companies with cheaper valuations. he also warns against being leveraged and emphasized on the role of diversification in mitigating risk. get wall street's hottest chart every morning",2025-02-03,49
"samsung offers galaxy s25 ultra at a discount of up to $1020, making it 3x cheaper than apple's iphone 16 pro: here's how you can get it for almost free - samsung electronics co  ( otc:ssnlf )  samsung electronics co.'s ssnlf galaxy s25 ultra is available at a significantly lower price than apple inc.'s aapl iphone 16 pro. what happened: the galaxy s25 ultra, part of the newly launched galaxy s25 series, is priced at $1299 for the 512gb model, down from its original $1419, thanks to a ...",2025-02-03,49
is schwab fundamental u.s. broad market etf  ( fndb )  a strong etf right now? smart beta etf report for ...,2025-02-03,49
"nvidia, smci, broadcom, and other tech stocks slide in monday pre-market as trump imposes tariffs on imports from china, mexico, and canada - apple  ( nasdaq:aapl )  u.s. technology stocks tumbled in pre-market trading monday after president donald trump imposed substantial tariffs on imports from canada, china, and mexico, raising concerns about potential retaliation affecting the tech sector. what happened: nvidia corp.",2025-02-03,49
"2 historically cheap warren buffett stocks to buy with confidence in february, and 1 to avoid the 44-stock, $303 billion portfolio the oracle of omaha oversees at berkshire hathaway has two amazing deals hiding in plain sight, as well as a pricey brand-name stock worth steering clear of.",2025-02-03,49
