cleaned_text,timestamp,days_elapsed
"deploy cash and reduce hedges, powerful market mechanics and trump tariffs control the stock market to gain an edge, this is what you need to know today. this change is primarily triggered by a combination of powerful market mechanics and president trump's tariff shift. keep in mind that this change may need to be quickly reversed if president trump changes his mind.",2025-03-24,0
"motley fool 2025 march market cap showdown championship it all comes down to this...the final round of the motley fool rule breaker investing march market cap showdown! defending champion andy cross has held off all contenders and pretenders, but game show survivor emily flippen is not one to back down from a challenge. who will win the crown for 2025?",2025-03-24,0
"tech sector to see major impact from tariffs and tesla's delivery numbers, predicts top analyst: calls april 2 as the 'vortex day' - apple  ( nasdaq:aapl ) , amazon.com  ( nasdaq:amzn )  gene munster, managing partner at deepwater asset management, has expressed concern over the potential impact of new tariffs on the tech sector, particularly on ""mag seven"" stocks.",2025-03-24,0
"investors heavily search apple inc.  ( aapl ) : here is what you need to know recently, zacks.com users have been paying close attention to apple (aapl). this makes it worthwhile to examine what the stock has in store.",2025-03-24,0
"best health & fitness stocks to buy for strong growth the health and fitness boom is fueling demand for gyms, nutrition, and wellness services. stocks like lth, ww, sfm, and bynd are well-positioned to benefit.",2025-03-24,0
should ishares russell top 200 etf  ( iwl )  be on your investing radar? style box etf report for ...,2025-03-24,0
should flexshares us quality large cap etf  ( qlc )  be on your investing radar? style box etf report for ...,2025-03-24,0
apple stock has a growth problem. is it really worth its premium valuation? investors are hoping ai will come to rescue the tech giant's underwhelming top line.,2025-03-24,0
"want to invest in quantum computing? 2 stocks that are great buys right now. the next big game-changing technology could be the ticket to explosive gains for your portfolio over time. and that technology may be quantum computing, a type of computing that aims to solve today's impossible problems.",2025-03-24,0
"apple's siri ai crisis, security flaws, and china sales woes: this week in appleverse - apple  ( nasdaq:aapl )  the past week has been a rollercoaster for apple inc. aapl, with the tech giant facing a series of challenges from internal turmoil to security oversights. the company's stock has taken a hit, falling over 12% this year.",2025-03-23,1
"2 millionaire-maker technology stocks to buy when it comes to looking for millionaire-making tech stocks, your best bet is to try to find small to mid-sized growth companies that have big potential. after all, a stock would need to go up 100x to turn a $10,000 investment into a $1 million.while these type of investment gains do occur, they ...",2025-03-23,1
"the best warren buffett stocks to buy with $2,000 right now the s&p 500 is down more than 7% over the past month ( as of this writing ) , inching closer to correction territory. investors are generally concerned about president donald trump's tariffs igniting trade wars and, as a result, the potential for the u.s. economy to slow down significantly.that's ...",2025-03-22,2
"should you buy berkshire hathaway while it's below $550? while the stock market has been selling off recently, one stock that has bucked the trend is berkshire hathaway ( nyse: brk.b ) ( nyse: brk.a ) . its shares are up more than 15% year to date as of this writing, and the stock is trading near an all-time high.let's look at why berkshire has ...",2025-03-22,2
"bulls and bears: tesla, nvidia, fedex - and the market digests the fed's rate decision bulls and bears: tesla, nvidia, fedex - and the market digests the fed's rate decision - apple  ( nasdaq:aapl )  benzinga examined the prospects for many investors' favorite stocks over the last week - here's a look at some of our top stories. markets ended the week mixed, with the s&p 500 and dow slipping while the nasdaq notched a slight gain, buoyed by strength in tech. tesla inc.",2025-03-22,2
"3 stocks warren buffett just bought when the stock market falls, investors can always find encouragement to stay the course by seeing relatively low portfolio turnover at warren buffett's berkshire hathaway. berkshire had held large positions in several stocks for years.",2025-03-22,2
"3 beloved stocks warren buffett is dumping as markets fall - apple  ( nasdaq:aapl ) , american express  ( nyse:axp )  the sage of omaha is laying low and lopping off once-favored stocks. here are the three most telling stocks warren buffet has been selling, and why. feel unsure about the market's next move? copy trade alerts from matt maley-a wall street veteran who consistently finds profits in volatile ...",2025-03-21,3
"nvda's magic buyback signals confidence - time to buy the stock? if nvidia continues its aggressive buybacks alongside its ai-driven revenue explosion, investors could see significant appreciation in the stock price.",2025-03-21,3
"sncr jumps 28% in a month: should you buy, sell or hold the stock? synchronoss's prospects benefit from cloud expansion and ai innovation amid stiff competition.",2025-03-21,3
"severance's fame is good for apple tv+: is it true for aapl stock? severance's success bodes well for apple's services business. however, apple intelligence delays, stretched valuation, and china headwinds are concerns in 2025.",2025-03-21,3
"how high or low can the spy go today? - spdr s&p 500  ( arca:spy )  good morning traders! in today's market clubhouse morning memo, we will discuss spy, qqq, aapl, msft, nvda, googl, meta, and tsla. our proprietary formula, exclusive to market clubhouse, dictates these price levels. this dynamic equation takes into account price, volume, and options flow.",2025-03-21,3
"apple tv+ bleeding over $1 billion yearly as streaming war heats up: report - apple  ( nasdaq:aapl ) , amazon.com  ( nasdaq:amzn )  the streaming service of apple inc. aapl, apple tv+, is reportedly incurring annual losses exceeding $1 billion. what happened: since its 2019 launch, apple has been allocating over $5 billion annually to content for apple tv+. however, this budget was cut by around $500 million last year.",2025-03-21,3
"apple stock down over 12% this year - now tim cook is reportedly betting on vision pro's mike rockwell to fix siri after losing confidence in ai boss john giannandrea - alphabet  ( nasdaq:goog ) , apple  ( nasdaq:aapl )  apple inc. aapl has been facing mounting pressure from investors and competitors. on thursday, ceo tim cook reportedly reshuffled its ai leadership to revive the struggling siri assistant and catch up in the generative ai race.",2025-03-21,3
"apple  ( aapl )  dips more than broader market: what you should know in the latest trading session, apple (aapl) closed at $214.10, marking a -0.53% move from the previous day.",2025-03-20,4
"top research reports for apple, meta platforms & chevron today's research daily features new research reports on 16 major stocks, including apple inc. (aapl), meta platforms, inc. (meta) and chevron corporation (cvx), as well as two micro-cap stocks taylor devices, inc. (tayd) and gsi technology, inc. (gsit).",2025-03-20,4
"nvidia's first quantum computing day, $4.5t quad witching, european banks beat tech stocks by 34% to gain an edge, this is what you need to know today. please click here for an enlarged chart comparing nasdaq 100 etf invesco qqq trust series 1 ( qqq ) to european financials etf ishares msci europe financials etf ( eufn ) . when 2025 started, investors were rushing headlong to buy ...",2025-03-20,4
"how to trade spy ahead of triple witching? - spdr s&p 500  ( arca:spy )  good morning traders! in today's market clubhouse morning memo, we will discuss spy, qqq, aapl, msft, nvda, googl, meta, and tsla. our proprietary formula, exclusive to market clubhouse, dictates these price levels. this dynamic equation takes into account price, volume, and options flow.",2025-03-20,4
"2 leading tech stocks to buy in 2025 they say a rising tide lifts all boats. well, the reverse is true, too: a falling tide lowers all boats. as it is in the water, so it is in the stock market. case in point: as of this writing, the tech-heavy nasdaq composite ( nasdaqindex: ^ixic ) has fallen by more than 9% year to date.",2025-03-20,4
is flexshares morningstar u.s. market factor tilt etf  ( tilt )  a strong etf right now? smart beta etf report for tilt ...,2025-03-20,4
is flexshares us quality large cap etf  ( qlc )  a strong etf right now? smart beta etf report for ...,2025-03-20,4
"could buying apple today set you up for life? every investor has heard of apple ( nasdaq: aapl ) . the consumer tech juggernaut has worked out to be a fantastic investment. its share price has catapulted a jaw-dropping 14,460% in the past 20 years ( as of march 17 ) .",2025-03-20,4
"up over 50% in 2025, is alibaba stock a buy now? alibaba is set for better times in 2025 and beyond.",2025-03-20,4
"will apple's slow artificial intelligence rollout help or hurt the stock? artificial intelligence ( ai ) is a huge opportunity for a device maker like apple ( nasdaq: aapl ) to take advantage of. with more than 2.2 billion active apple devices in the world, if the company can use ai to help create a new income stream for its operations, that can be a huge growth ...",2025-03-20,4
"how the smart money gets rich when markets crash - apple  ( nasdaq:aapl ) , american express  ( nyse:axp )  with markets in an uproar lately, i've been thinking about the lessons we can learn from those rare individuals who don't just survive bear markets - they thrive in them. today, let's take a look at the extraordinary wealth created by a special breed of investor who sees opportunity where others ...",2025-03-19,5
"human-like reasoning ai agents and robots are a big market for nvidia, but nvidia stock has a problem - general motors  ( nyse:gm ) , spdr gold trust  ( arca:gld )  to gain an edge, this is what you need to know today. please click here for an enlarged chart of nvidia corp nvda. nvidia is doing excellent as a company. there is a disconnect between nvda stock price and nvidia as a company. the biggest market of all will be the market for robots.",2025-03-19,5
"snap falls 22% in a year: should you buy, sell or hold the stock? snap advances in ar and benefits from advertising revenue growth, but competition and regional pressures suggest investors should wait for better entry points in 2025.",2025-03-19,5
"90% advancing days offer a glimmer of hope in a corrective market while the market navigates a complex landscape of geopolitical uncertainty, tariffs, and interest rates, the confluence of robust market breadth signals, historically favorable seasonality, and deeply depressed bullish sentiment offers a compelling narrative for future gains.",2025-03-19,5
is this simple index fund a millionaire maker? wondering if you should look beyond american markets to build your fortune? this widely held international fund offers a few opportunities and several challenges.,2025-03-19,5
should ishares russell 1000 growth etf  ( iwf )  be on your investing radar? style box etf report for ...,2025-03-19,5
"prediction: buying this vanguard etf today will set you up for life what's an 11-letter word that begins with ""o"" and aptly describes a stock market pullback like the one we're seeing right now? it's easy: the word is ""opportunity.""forward-thinking investors should view the current market volatility as a great opportunity. and you don't even have to be a ...",2025-03-19,5
"1 unstoppable tech etf that could turn $500 per month into $1 million within 30 years last week, the nasdaq-100 technology index officially entered correction territory after declining by more than 14% from its recent record high. the index hosts some of the world's largest technology stocks, particularly those at the forefront of the artificial intelligence ( ai ) revolution.",2025-03-19,5
"nvidia loses $420 billion in market capitalization since deepseek launch, valuation hits a 29-month low as gtc fails to ignite stock - apple  ( nasdaq:aapl ) , general motors  ( nyse:gm )  a slew of announcements at the gtc ai conference in san jose, california failed to ignite the shares of nvidia corp. nvda on tuesday as it slipped over 3% in trade. the chipmaker led by jensen huang has wiped $420 billion in investor wealth since deepseek was launched on jan. 10, 2025",2025-03-19,5
"bear of the day: globalstar  ( gsat )  globalstar (gsat) stock has plummeted over 30% year to date, and unfortunately, the decline could continue.",2025-03-19,5
interested in investing in micro-cap stocks? check out this information.,2025-03-19,5
"here's how much you would have made owning apple stock in the last 10 years - apple  ( nasdaq:aapl )  apple aapl has outperformed the market over the past 10 years by 10.59% on an annualized basis producing an average annual return of 20.98%. currently, apple has a market capitalization of $3.19 trillion.",2025-03-18,6
"welcome back to correction territory in this podcast, motley fool analyst anthony schiavone and host ricky mulvey discuss:then, motley fool analyst nick sciple joins ricky to chat about tko group, the company's new boxing league, and why company insiders are buying up shares.to catch full episodes of all the motley fool's free ...",2025-03-18,6
"trading spy ahead of fed interest rate decision tomorrow - meta platforms  ( nasdaq:meta ) , spdr s&p 500  ( arca:spy )  good morning traders! in today's market clubhouse morning memo, we will discuss spy, qqq, aapl, msft, nvda, googl, meta, and tsla. our proprietary formula, exclusive to market clubhouse, dictates these price levels. this dynamic equation takes into account price, volume, and options flow.",2025-03-18,6
"apple partner globalstar just set a new record, but did you even notice? on feb. 27, satellite communications company globalstar ( nasdaq: gsat ) reported the end of its best revenue year ever. if you didn't notice, though, don't feel bad. it actually looks like almost no investors noticed.two weeks after announcing its results, globalstar's stock is...down about 2% ...",2025-03-18,6
"s&p 500 correction: 1 incredible ai stock that i'm buying now and holding forever with the s&p 500 ( snpindex: ^gspc ) closing 10% below its all-time high, it's now in correction territory. while nobody likes seeing their holdings decline by 10% or more, corrections occur about every year, so nobody should be surprised when they happen.",2025-03-18,6
is ishares paris-aligned climate msci usa etf  ( pabu )  a strong etf right now? smart beta etf report for ...,2025-03-18,6
"the best warren buffett stocks to buy with $2,000 right now while stocks as a whole are selling off, there's a reason the oracle of omaha is sticking with these beaten-down holdings.",2025-03-18,6
"ai bubble bursting? magnificent 7's profit margins face pressure as 'capital spending can tumble' in 2025 - apple  ( nasdaq:aapl ) , amazon.com  ( nasdaq:amzn )  as the magnificent 7 companies have estimated a total capital expenditure of over $330 billion on the artificial intelligence infrastructure in 2025, there is a possibility that china's ai breakthrough, despite chip shortage, could affect their targets, affecting profitability.",2025-03-18,6
"apple stock faces pressure from declining iphone revenue: could company's first foldable smartphone in 2026 reverse course? - alphabet  ( nasdaq:goog ) , apple  ( nasdaq:aapl )  a foldable iphone could be coming as early as 2026 according to several reports. apple has been working on foldable devices for years, says reports. join nic chahine live on wednesday, march 19, at 6 pm et for a step-by-step breakdown of how to to capitalize on post-fed volatility and manage ...",2025-03-17,7
"legendary trader says tesla, nvidia, apple shares are ready to rally: 'i see what i like to see' - tesla  ( nasdaq:tsla )  renowned trader and chartist larry williams believes the market is ready to rally. williams says tesla, nvidia, asml holding and apple shares are flashing bullish signs.",2025-03-17,7
"nvidia gtc and quantum computing drivers of the stock market, trump put fails but may not be dead to gain an edge, this is what you need to know today. please click here for an enlarged chart of nvidia corp ( nvda ) . on the positive side, expectations are for nvidia's data center revenue to reach $237b by january 2027. that is more than double current revenue.",2025-03-17,7
should ishares russell 1000 etf  ( iwb )  be on your investing radar? style box etf report for ...,2025-03-17,7
"warren buffett dumped nearly 70% of apple shares, but its price-to-sales ratio remains elevated at 8.2x, warns this market analyst - nvidia  ( nasdaq:nvda )  apple inc. aapl continues to trade at elevated valuation levels despite warren buffett's berkshire hathaway inc. significantly reducing its stake in the iphone maker, according to a prominent market analyst.",2025-03-17,7
"consumer tech news  ( mar 10-mar 14 ) : manus ai creating hype, tesla eyes affordable version model y in china & more - apple  ( nasdaq:aapl ) , amazon.com  ( nasdaq:amzn )  goldman sachs warns tariffs may hurt u.s. automakers by increasing costs and reducing vehicle production. epa moves to reverse biden-era vehicle emissions rules, impacting automakers' future regulatory landscape. next: get access to a new market-moving chart every day featuring a stock flashing ...",2025-03-16,8
"nasdaq correction: 2 ai stocks that aren't worth buying on the dip with the nasdaq index in correction territory, many investors are trying to decide if it's a buying opportunity or if they should run for the hills. a correction is marked by an index declining 10% from its all-time high, which isn't quite as severe as a bear market.",2025-03-16,8
"market correction: 3 top tech stocks to buy on the dip the recent market correction has brought on significant investor pain. with the market suffering the worst one-day drop since 2022 on march 10, buying may be the last thing some investors want to do.nonetheless, the market has rebounded from every previous downturn in history and will almost ...",2025-03-16,8
"this artificial intelligence  ( ai )  stock is a ""magnificent seven"" leader. but is it a buy? the ai business is evolving as it matures, creating opportunities for new leaders.",2025-03-16,8
3 stocks that could be easy wealth builders don't make it complicated. sometimes the most obvious picks truly are your top prospects.,2025-03-16,8
"1 super stock that could join nvidia, apple, microsoft, alphabet, amazon, and meta in the $1 trillion club the u.s. economy has produced the world's most valuable companies for more than a century. united states steel became the first $1 billion company in 1901, and 117 years later in 2018, apple became the first enterprise to achieve a valuation of $1 trillion.",2025-03-15,9
"billionaire warren buffett's artificial intelligence  ( ai )  investing strategy may surprise you warren buffett isn't known for his tech investing. for decades, he famously avoided the sector. this caused him issues during the dot-com bubble when tech stocks were soaring in value. but when that bubble popped, buffett looked like a genius.",2025-03-15,9
"warren buffett's berkshire hathaway sold $134 billion in stocks in 2024, timing it perfectly as recession fears mount: the internet is in awe last year, warren buffett was criticized and mocked for sitting on a mountain of cash while markets surged. however, now, with stocks tumbling and recession fears mounting, the ""oracle of omaha"" suddenly looks like the only one who saw it coming.",2025-03-15,9
"apple scrambles to fix siri's ai failures after public misstep-top executive admits marketing it too soon made things worse - apple  ( nasdaq:aapl ) , amazon.com  ( nasdaq:amzn )  apple inc. aapl is reportedly facing internal turmoil as it struggles to fix major ai failures in siri, with a top executive calling the delays ugly and embarrassing after the company prematurely marketed features that weren't ready.",2025-03-15,9
"apple  ( aapl )  rises but trails market: what investors should know apple (aapl) concluded the recent trading session at $213.49, signifying a +1.82% move from its prior day's close.",2025-03-14,10
"apple stock could get 'ted lasso' boost: hit soccer comedy set for fourth season - apple  ( nasdaq:aapl ) , comcast  ( nasdaq:cmcsa )  a fourth season of ""ted lasso"" has been confirmed to stream on apple tv+. the first three seasons saw many award nominations and strong viewership for apple. find out which stock just plummeted to the bottom of the new benzinga rankings. updated daily-spot the biggest red flags before it's too ...",2025-03-14,10
"generate passive income from this low-cost vanguard etf that is crushing the s&p 500 in 2025 investors typically turn to dividend-paying stocks and exchange-traded funds ( etfs ) to boost their passive income streams so that their returns aren't solely tied to stock price gains. but so far this year, many value and income stocks have performed better than growth stocks.",2025-03-14,10
"why ross gerber finds tesla stock expensive despite its 50% plunge? 'fundamental story has to be revalued' - tesla  ( nasdaq:tsla )  despite nearly a 50% drop since mid-december, tesla inc. tsla shares are still too expensive to attract seasoned investor ross gerber back into the fold.",2025-03-14,10
"producer inflation craters, a government shutdown will be a buying opportunity - alphabet  ( nasdaq:goog ) , amazon.com  ( nasdaq:amzn )  to gain an edge, this is what you need to know today. please click here for an enlarged chart of spdr s&p 500 etf trust ( spy ) which represents the benchmark stock market index s&p 500 ( spx ) . headline ppi came at 0.0% vs. 0.3% consensus. core ppi came at -0.1% vs. 0.3% consensus.",2025-03-13,11
"nasdaq correction: my top 3 ""magnificent seven"" stocks to buy now artificial intelligence innovation could be a massive tailwind for these three ""magnificent seven"" stocks.",2025-03-13,11
"garmin rises 45% in a year: is it the right time to buy the stock? grmn's fitness, outdoor and marine products are going to be the key growth drivers for garmin in the upcoming quarters.",2025-03-13,11
"why nvidia is the top ""magnificent seven"" stock to buy now nvidia is expected to grow its revenue faster than the rest of the ""magnificent seven."" ...",2025-03-13,11
"35.2% of warren buffett's $281 billion portfolio is invested in 3 artificial intelligence  ( ai )  stocks warren buffett is the ceo of the berkshire hathaway ( nyse: brk.a ) ( nyse: brk.b ) holding company, where he oversees a $281 billion portfolio of publicly traded stocks and securities, in addition to several privately held subsidiaries.",2025-03-13,11
"apple stock takes a bite out of investors as siri fumbles ai race - apple  ( nasdaq:aapl )  apple's stock is down 10.85% ytd as ai delays hurt its iphone sales outlook. morgan stanley slashes apple's price target, citing siri's delayed ai upgrade and tariff-related cost concerns. the new benzinga rankings show you exactly how stocks stack up-scoring them across five key factors that ...",2025-03-12,12
"nasdaq correction: i'd consider buying the dip on all ""magnificent seven"" stocks -- except this one after peaking on dec. 16, the nasdaq composite -- which tracks almost every stock trading on the nasdaq stock exchange -- has entered into a correction. the index is down around 9% year to date and 13% from its december peak.considering the nasdaq composite is tech-heavy, it's no surprise that ...",2025-03-12,12
"stock market news for mar 12, 2025 wall street closed sharply lower on tuesday, continuing on a broad-based fall.",2025-03-12,12
"palantir ceo becomes top-earning tech boss as ai stock soars 216%: report - palantir technologies  ( nasdaq:pltr )  palantir ceo alex karp tops big tech with $12.8b stake as stock jumps 216% in 12 months karp's gains outpace apple, google, amazon, and microsoft chiefs' combined stock sales in 2024 find out which stock just plummeted to the bottom of the new benzinga rankings.",2025-03-12,12
"how to trade spy as market focuses on cpi data good morning traders! in today's market clubhouse morning memo, we will discuss spy, qqq, aapl, msft, nvda, googl, meta, and tsla. our proprietary formula, exclusive to market clubhouse, dictates these price levels. this dynamic equation takes into account price, volume, and options flow.",2025-03-12,12
"alibaba chair says ai total addressable market is $10 trillion, expects benefits via its cloud business - alibaba gr hldgs  ( nyse:baba )  alibaba's joe tsai says ai may replace equity analysts, but boost work quality by handling tedious research tasks tsai sees $10t ai market ahead, expects alibaba to benefit via cloud, legal ai tools, and open-source chip advances find out which stock just claimed the top spot in the new benzinga ...",2025-03-12,12
"top wide-moat stocks worth investing in for sustainable growth in 2025 investing in wide-moat stocks like tsm, nvda, intu and spgi can be a strategy for long-term wealth creation due to their ability to deliver consistent returns.",2025-03-12,12
is ishares esg aware msci usa etf  ( esgu )  a strong etf right now? smart beta etf report for ...,2025-03-12,12
"3 ai chip stocks to buy in the nasdaq correction the nasdaq entered correction territory earlier this week, and a number of leading artificial intelligence ( ai ) semiconductor stocks have been swept up in the market downturn. however, spending on ai infrastructure has not suddenly dried up, and in fact it is still on the rise.the three big ...",2025-03-12,12
