cleaned_text,timestamp,days_elapsed
apple stock to get a boost from indonesia? iphone 16 ban could be over soon - apple  ( nasdaq:aapl )  apple could be nearing a return to indonesia for the iphone 16 after a multi-month ban. the return could boost iphone 16 sales and see apple return to trying to take premium smartphone market share.,2025-02-26,26
"what's going on with applied materials  ( amat )  shares? - applied mat  ( nasdaq:amat )  shares of applied materials are trading higher by 2.6% during wednesday's session. investors anticipate q4 earnings from nvidia after the market close. get 5 stock picks identified before their biggest breakouts, identified by the same system that spotted insmed, sprouts, and uber before their ...",2025-02-26,26
"spotify surges 133% in a year: buy, sell, or hold the stock? given spot's price rise, we analyze its current position to find out whether investors should buy it, hold it, or book profits.",2025-02-26,26
"prediction: this artificial intelligence  ( ai )  company will split its stock in 2025 stock splits, particularly in the tech sector, have gained attention in recent months. as stocks such as nvidia and broadcom rose above $1,000 per share, they each executed stock splits, probably in an attempt to attract more prospective investors.amid this paradigm, it might surprise some ...",2025-02-26,26
"apple's smart doorbell may feature magsafe, face id, and smart lock integration: but you won't see it anytime soon - apple  ( nasdaq:aapl )  apple inc. aapl is reportedly developing a smart home doorbell with magsafe and face id - though it may not hit the market until late 2025 or beyond. what happened: a new leak from x user kosutami suggests that apple's rumored smart doorbell could feature magsafe.",2025-02-26,26
"masimo tops eps, revenue expectations masimo impressed with a robust earnings report driven by its healthcare segment, despite challenges from non-healthcare operations.",2025-02-25,27
"apple shareholders uphold dei programs amid corporate rollbacks - apple  ( nasdaq:aapl )  apple shareholders voted to uphold the company's dei programs. the proposal argued that dei initiatives could lead to discrimination and pose financial risks. get access to your new suite of high-powered trading tools, including real-time stock ratings, insider trades, and government trading ...",2025-02-25,27
"stmicroelectronics faces leadership shakeup, italy seeks new ceo amid semiconductor struggles - stmicroelectronics  ( nyse:stm )  italy considers replacing stmicroelectronics ceo after weak performance and struggles in auto and industrial semiconductor demand. stmicroelectronics stock dropped 30% in a year as revenue slumped, prompting concerns over leadership and industry downturn.",2025-02-25,27
"momo stocks sell off as trump hopium meets reality, all eyes on nvidia, china caught cutting cable to gain an edge, this is what you need to know today. please click here for an enlarged chart of hims & hers health inc ( hims ) . in many areas, hopium from president trump is justified. however, the momo crowd has taken it to an extreme.",2025-02-25,27
"how to trade the spy and top tech stocks today? good morning traders! in today's market clubhouse morning memo, we will discuss spy, qqq, aapl, msft, nvda, googl, meta, and tsla. our proprietary formula, exclusive to market clubhouse, dictates these price levels. this dynamic equation takes into account price, volume, and options flow.",2025-02-25,27
"apple inc.  ( aapl )  is a trending stock: facts to know before betting on it zacks.com users have recently been watching apple (aapl) quite a bit. thus, it is worth knowing the facts that could determine the stock's prospects.",2025-02-25,27
"buffett's japan play: why investors shouldn't sleep on these stocks, etfs - wisdomtree japan hedged equity fund  ( arca:dxj ) , jpmorgan betabuilders japan etf  ( bats:bbjp ) , ishares msci japan index fund  ( arca:ewj )  buffett eyes bigger stakes in japan's trading houses, sending stocks soaring up to 9%. etfs like dxj, ewj and bbjp gain traction as japan's corporate reforms attract global investors. get two weeks of free access to pro-level trading tools, including news alerts, scanners, and real-time market ...",2025-02-25,27
should you invest in the ishares expanded tech sector etf  ( igm ) ? sector etf report for ...,2025-02-25,27
"us stocks likely to open lower: 'caution is warranted,' says expert as investors navigate 'complex dynamics' ahead - alibaba gr hldgs  ( nyse:baba ) , apple  ( nasdaq:aapl )  u.s. stock futures fell on tuesday following monday's mixed close. futures of all the four benchmark indices declined in premarket trading. investor anxiety over tariffs and anticipation of nvidia corp.'s nvda earnings this week weighed on the sentiment.",2025-02-25,27
"warren buffett just gave investors 3 big warnings about the stock market berkshire hathaway ( nyse: brk.a ) ( nyse: brk.b ) just gave investors quite a bit of insight into its business. the conglomerate released its year-end 2024 earnings report, ceo warren buffett's annual letter to shareholders, and reported its fourth quarter stock portfolio activity.in short, it ...",2025-02-25,27
"will nvidia's q4 results lift markets back to new highs? amid recent market volatility, investors are anxiously awaiting nvidia's (nvda) q4 results after-market hours on wednesday, february 26.",2025-02-24,28
"steve jobs' signed apple business card, valued at $60,000, sells for much more at auction: here's the winning bid - apple  ( nasdaq:aapl )  a rare steve jobs autograph was offered via auction and topped the pre-auction estimate. steve jobs memorabilia has been hot for investors and collectors after his death in 2011. get real-time earnings alerts before the market moves and access expert analysis that uncovers hidden opportunities ...",2025-02-24,28
"bull market intact: why friday's plunge was likely overdone after stocks plunged friday and the nasdaq gave up its year-to-date gains, investors may wonder whether or not the us equity bull market remains intact. stock strategist andrew rocco provides some timely clues.",2025-02-24,28
"palantir extends losses, microsoft slides: what's driving markets monday? - spdr s&p 500  ( arca:spy )  investors are closely watching nvidia's upcoming quarterly earnings report, scheduled for release on wednesday. natural gas futures fall more than 6% toward $43.9/mmbtu, retreating from a 25-month high reached last week.",2025-02-24,28
"taiwan semiconductor poised for surge, goldman sachs predicts rising demand for taipei-traded stock: report - taiwan semiconductor  ( nyse:tsm )  taiwan semiconductor's stock has soared by over 2900%, fueled by ai developments and key partnerships with nvidia and apple. changes in taiwan's etf regulations could increase demand for local shares, potentially lifting the current 30% cap on single-stock weight i",2025-02-24,28
"should you buy apple stock instead of microsoft stock? apple ( nasdaq: aapl ) and microsoft ( nasdaq: msft ) are two of the most successful companies in the world, but only one can be the better long-term investment in this comparison.*stock prices used were the afternoon prices of feb. 20, 2025. the video was published on feb. 22, 2025.continue ...",2025-02-24,28
"apple makes $500 billion bet: is aapl stock ready to shine or stumble? - apple  ( nasdaq:aapl )  apple's stock stays bullish, trading above key moving averages with strong macd and rsi indicators. rising selling pressure hints at a potential cooldown despite apple's $500 billion u.s. investment plan. get two weeks of free access to pro-level trading tools, including news alerts, scanners, ...",2025-02-24,28
is ishares core s&p u.s. growth etf  ( iusg )  a strong etf right now? smart beta etf report for ...,2025-02-24,28
should ishares s&p 100 etf  ( oef )  be on your investing radar? style box etf report for ...,2025-02-24,28
"apple ditches budget smartphone segment with iphone 16e launch - apple  ( nasdaq:aapl )  apple breaks away from the budget phone race with its new iphone 16e's premium pricing. get access to your new suite of high-powered trading tools, including real-time stock ratings, insider trades, and government trading signals. in a strategic shift, apple inc.",2025-02-23,29
"consumer tech news  ( feb 17-feb 21 ) : mexico warns alphabet over naming of the ""gulf of mexico"" on maps, apple launches iphone 16e & more - apple  ( nasdaq:aapl ) , amazon.com  ( nasdaq:amzn )  bumble's revenue falls to $261.6m in q4, with paying users dropping by 57k from the previous quarter. apple plans in-house 5g modem for iphone se 4 but may lag behind qualcomm's snapdragon x75.",2025-02-23,29
"if you invested $10,000 in apple stock 30 years ago, here's how much you would have today all investors dream about finding that one stock that can catapult them into millionaire status. you can never know which stocks are going to be those rare winners, and there's certainly a bit of luck in choosing your portfolio.",2025-02-23,29
"apple's iphone 16e launch, us investment pledge, potential price hikes, and more: this week in appleveres - apple  ( nasdaq:aapl )  it was an eventful week for tech giant apple inc. aapl, with the company making headlines for a variety of reasons. from the launch of a new budget-friendly iphone to a significant investment pledge in the united states, apple was in the spotlight. here's a recap of the top stories.",2025-02-23,29
"apple's iphone 16e launch, us investment pledge, potential price hikes, and more: this week in appleverse - apple  ( nasdaq:aapl )  it was an eventful week for tech giant apple inc. aapl, with the company making headlines for a variety of reasons. from the launch of a new budget-friendly iphone to a significant investment pledge in the united states, apple was in the spotlight. here's a recap of the top stories.",2025-02-23,29
"2 no-brainer chip companies to ride the artificial intelligence  ( ai )  investing wave when you hear about artificial intelligence ( ai ) investing, you may think of the software powered by the technology or the hardware that trains the model. however, investors should also think of the chips that go into these devices to power the ai models.the chip market is a huge investment ...",2025-02-23,29
"is apple a buy, sell, or hold in 2025? with a market capitalization of $3.7 trillion, apple ( nasdaq: aapl ) is the largest company in the world. meanwhile, most investors own the stock either directly or indirectly through exchange-traded funds ( etfs ) or mutual funds that track major market indices.",2025-02-23,29
"billionaire philippe laffont just loaded up on my favorite artificial intelligence  ( ai )  stock the latest round of 13f filings is out, which means investors can see what billionaire hedge fund managers have been doing with their money. one firm i follow is coatue management, run by billionaire philippe laffont. in the fourth quarter, his firm bought 596,000 shares of one of my favorite ...",2025-02-22,30
"could buying roku stock today set you up for life? roku ( nasdaq: roku ) recently reported financial results for the three-month period that ended dec. 31, 2024. revenue increased 22% year over year to $1.2 billion. the business posted a net loss per share of $0.24, a notable improvement from q4 2023. these headline figures came in ahead of wall ...",2025-02-22,30
"top analyst wars of looming stock market correction as s&p 500 records biggest single day loss since dec. 18: 'we could see it trigger a larger sell off' - nvidia  ( nasdaq:nvda ) , apple  ( nasdaq:aapl )  goldman sachs expert scott rubner has cautioned that wall street stocks may face a downturn, citing growing instability in the options market as a key factor behind his prediction.",2025-02-22,30
"china stocks: why the party is just starting in today's commentary, stock strategist andrew rocco explains how an expanding balance sheet, record share buybacks, and historically high short interest suggest that the chinese stock market is just getting started.",2025-02-21,31
"apple expands apple tv+ to android, eyes subscription growth and ecosystem expansion, analyst says - alphabet  ( nasdaq:goog ) , apple  ( nasdaq:aapl )  apple expands apple tv app to android users, aiming to boost subscription revenue and brand awareness. bofa analyst sees apple tv+ on android driving $2 billion in revenue and enhancing long-term ios migrations.",2025-02-21,31
"alibaba jumps post q3 earnings: etfs to buy alibaba records its fastest pace of revenue growth in more than a year, spreading cheer among investors.",2025-02-21,31
"china's oppo heats up smartphone landscape, launches ai-powered foldable at competitive price - alibaba gr hldgs  ( nyse:baba ) , apple  ( nasdaq:aapl )  oppo unveils ai-powered foldable find n5, challenging apple and samsung with advanced camera and ai assistant features apple fights to regain market share as oppo, huawei, and samsung push ai-driven smartphones at competitive prices",2025-02-21,31
"if i could only buy 1 warren buffett artificial intelligence  ( ai )  stock, this would be it  ( hint: it's not apple )  apple is berkshire hathaway's largest position, but i see a different artificial intelligence (ai) stock as the better opportunity.",2025-02-21,31
"spy: how high or low could it potentially go today? - microsoft  ( nasdaq:msft )  good morning traders! in today's market clubhouse morning memo, we will discuss spy, qqq, aapl, msft, nvda, googl, meta, and tsla. our proprietary formula, exclusive to market clubhouse, dictates these price levels. this dynamic equation takes into account price, volume, and options flow.",2025-02-21,31
"taiwan semiconductor too big for the index, regulator considers lifting weight cap - taiwan semiconductor  ( nyse:tsm )  taiwan may lift etf stock cap as tsmc's market weight surges past 37%, complicating index tracking. tsmc ramps up us expansion amid taiwan's push for stronger ai chip alliances and trade ties.",2025-02-21,31
"blackrock's bitcoin etf or invesco qqq, which $1,000 investment made a year ago would have netted you more profit? - apple  ( nasdaq:aapl )  the invesco qqq trust qqq is one of the most popular exchange-traded funds in the world, giving customers exposure to the tech-heavy nasdaq-100 index. it has over $341 billion in assets under management as of this writing",2025-02-21,31
"why did warren buffett just sell investments he's recommended millions of others buy? warren buffett wrote to berkshire hathaway shareholders in 2014 that most investors shouldn't try to pick individual stocks to buy because they couldn't ""predict their future earnings power."" instead, he recommended that the typical investor buy a ""low-cost s&p 500 index fund."" berkshire's ...",2025-02-21,31
60% of warren buffett's $299 billion portfolio at berkshire hathaway is invested in these 4 magnificent stocks the oracle of omaha has $180 billion collectively invested in four brand-name companies with well-defined competitive advantages and phenomenal capital-return programs.,2025-02-21,31
"1 supercharged growth etf i'm buying hand over fist right now investing in the stock market is a powerful way to build wealth, and exchange-traded funds ( etfs ) make the process simpler and more approachable.a growth etf is a collection of stocks with the potential to earn higher-than-average returns, with all of these stocks bundled together into a ...",2025-02-21,31
prediction: 1 artificial intelligence  ( ai )  stock that will be worth more than nvidia 5 years from now demand for chips that power artificial intelligence (ai) could eventually slow.,2025-02-21,31
"apple stock has run up over 10% in a month, jim cramer says iphone maker is 'ramping' and the credit goes to chinese subsidies - apple  ( nasdaq:aapl )  apple inc. aapl shares have gained over 10% in the past month, with cnbc's jim cramer attributing recent momentum to chinese government subsidies covering apple products. what happened: ""apple phone qualifies for china subsidies.. big reason why ramping last few days,"" cramer wrote on x on thursday.",2025-02-21,31
"unity software: earnings beat sparks breakout unity software's recent earnings beat, breakaway gap, and leadership certainty signal a bright future for the stock over the next 6-12 months.",2025-02-20,32
"can the latest iphone 16e push the apple stock higher in 2025? although aapl's ai push and growing services business are positives, stretched valuation and china headwinds are concerning in 2025.",2025-02-20,32
"apple stock set for streaming lift? 'severance' breaks record after x ads, tim cook promo - apple  ( nasdaq:aapl )  appletv+ has a streaming hit with ""severance."" the recent second season saw high viewership and strong sign-ups for the streaming platform. get access to your new suite of high-powered trading tools, including real-time stock ratings, insider trades, and government trading signals.",2025-02-20,32
"lkq q4 earnings surpass expectations, revenues decline y/y lkq reports mixed fourth-quarter results and expects 2025 parts and services organic revenue growth in the range of 0-2% year over year.",2025-02-20,32
"how to trade spy, qqq, aapl, msft, nvda, googl, meta, tsla today good morning traders! in today's market clubhouse morning memo, we will discuss spy, qqq, aapl, msft, nvda, googl, meta, and tsla. our proprietary formula, exclusive to market clubhouse, dictates these price levels. this dynamic equation takes into account price, volume, and options flow.",2025-02-20,32
"stock market news for feb 20, 2025 u.s. stock ended higher on wednesday, with the s&p 500 closing at a fresh record high, as investors assessed the minutes from the federal reserve's january policy meeting and weighed president donald trump's tariff threats.",2025-02-20,32
"alibaba q3 earnings: revenue and eps beat, eyes global e-commerce profitability in fy25, increase investments in ai - alibaba gr hldgs  ( nyse:baba )  alibaba beats q3 estimates with 8% revenue growth as cloud and international commerce drive strong gains. alibaba's cash reserves hit $83.6b as ai-driven cloud growth and global expansion fuel momentum.",2025-02-20,32
is ishares msci usa quality garp etf  ( garp )  a strong etf right now? smart beta etf report for ...,2025-02-20,32
"the ultimate warren buffett stock to buy with $1,000 right now berkshire hathaway is still the oracle of omaha's best long-term investment.",2025-02-20,32
"bitcoin-friendly bank stock held by warren buffett and cathie wood has crushed their top holdings apple and tesla in 2025 - grayscale bitcoin mini trust  ( btc )  common units of fractional undivided beneficial interest  ( arca:btc )  berkshire hathaway chairman warren buffett and ark invest ceo cathie wood are two of the most sought-after investors in the capital markets, with significant media attention centered on their stock picks.",2025-02-20,32
"this simple dividend etf could turn $1,000 a month into more than $232,000 the jpmorgan nasdaq equity premium income etf ( nasdaq: jepq ) is one of the market's most interesting monthly income-paying exchange-traded funds ( etfs ) . its management aims to generate relatively low-volatility returns and a consistent monthly income for investors through a simple strategy ...",2025-02-20,32
"warren buffett just pressed the sell button on the stock market. but there is a silver lining each quarter, investors wait for warren buffett's company berkshire hathaway ( nyse: brk.a ) ( nyse: brk.b ) to file its 13-f form with the securities and exchange commission, disclosing what stocks the company owned at the end of each quarter.",2025-02-20,32
"marjorie taylor greene just bought these 5 artificial intelligence  ( ai )  stocks. should you? some closely follow the stocks bought and sold by famous investors such as warren buffett. copying buffett's investments through the years would have enabled you to make a lot of money.another strategy that has become increasingly popular recently, though, is to follow the stocks bought and sold ...",2025-02-20,32
"trump's goal is to 'abolish' irs and 'let all the outsiders pay,' says newly confirmed commerce secretary howard lutnick - apple  ( nasdaq:aapl ) , boeing  ( nyse:ba )  howard lutnick, the newly confirmed commerce secretary under president donald trump's administration, reiterated the president's proposal for the abolition of the internal revenue service ( irs ) .",2025-02-20,32
"apple's newly launched iphone 16e will boost the iphone revenue for fy25, predicts deepwater's gene munster - alibaba gr hldgs  ( nyse:baba ) , apple  ( nasdaq:aapl )  deepwater management's gene munster anticipates a revenue boost for apple inc. aapl in fy25, driven by the newly launched iphone 16e. what happened: on wednesday, munster posted his insights on apple's latest offering, iphone 16e on x.",2025-02-20,32
"apple may hike iphone prices by nearly 9% to counter trump's tariffs, forecasts bofa. expects eps decline in 2026 - bank of america  ( nyse:bac )  in response to the tariffs imposed by the trump administration, apple inc. aapl might have to raise iphone prices by 9%, said analysts at the bank of america.",2025-02-20,32
"top analyst predicts apple will hit $4 trillion first followed by nvidia - says ai demand is 'exploding' despite tariffs and deepseek fears: 'the bears can't see ai in the spreadsheets...' - apple  ( nasdaq:aapl ) , amazon.com  ( nasdaq:amzn )  wedbush analyst dan ives remains bullish on ai stocks, predicting apple inc. aapl will be the first to reach a $4 trillion market cap, followed by nvidia corporation nvda, despite concerns over tariffs and rising competition from china's deepseek.",2025-02-20,32
what's behind the surge in chinese tech stocks & etfs? we discuss whether investors should consider investing in chinese stocks now.,2025-02-19,33
"exclusive: apple, nvidia, tesla or boeing? which company faces the biggest risk from trump's china tariffs - 35% say this stock - apple  ( nasdaq:aapl ) , boeing  ( nyse:ba )  benzinga readers share which companies could be most hurt by tariffs on china. china is one of the country's targeted the most by president donald trump with tariffs. get real-time earnings alerts before the market moves and access expert analysis that uncovers hidden opportunities in the ...",2025-02-19,33
"apple iphone 16e announced with a18 chip, apple intelligence, starting at $599: features, availability and more - apple  ( nasdaq:aapl )  apple unveils iphone 16e with oled display, a18 chip, and custom modem budget-friendly iphone 16e launches at $599 with five color options get real-time earnings alerts before the market moves and access expert analysis that uncovers hidden opportunities in the post-earnings chaos.",2025-02-19,33
"rule breaker investing stock stories, vol. 10: frosty campfire, fiery stocks every stock tells a story. it takes humans to find the meaning in it.",2025-02-19,33
"tiger global, appaloosa, soros outshine warren buffett & carl icahn's funds in q4 - alibaba gr hldgs  ( nyse:baba ) , apple  ( nasdaq:aapl )  tiger, appaloosa, and soros made bold q4 bets, outshining buffett and icahn in hedge fund rotations. ai and high-growth stocks dominated q4 moves, while legacy investors like buffett and icahn lagged behind.",2025-02-19,33
"3 reasons to buy apple stock like there's no tomorrow even without much growth to speak of for the last couple of years, this dominating company is still building shareholder value.",2025-02-19,33
"big tech's spending spree in this podcast, motley fool analysts ron gross and jason moser and host dylan lewis discuss:and motley fool host ricky mulvey chats with motley fool analyst nick sciple for the investing angle on legalized sports betting and why parlays are the penny stocks of gambling.to catch full episodes of ...",2025-02-19,33
"5 top tech stocks hedge funds have been bullish on in q4  ( hint: it's not nvidia )  - microsoft  ( nasdaq:msft ) , crowdstrike holdings  ( nasdaq:crwd ) , spdr select sector fund - technology  ( arca:xlk ) , servicenow  ( nyse:now )  hedge funds favored xlk, crowdstrike, palantir, servicenow and microsoft in q4 2024, diversifying beyond nvidia. institutional investors bet on cybersecurity, ai, and cloud software instead of concentrating solely on nvidia's ai dominance.",2025-02-19,33
"4 top big data stocks to add to your portfolio right away the big data industry is expected to grow significantly in the future. as a result, companies like nvda, crm, pltr and mco are likely to benefit.",2025-02-19,33
"is xrp a warren buffett coin? warren buffett's famous value investing philosophy is why he bought shares in companies ranging from american express to apple and beyond. but could he one day want to invest in a money transfer fintech like xrp ( crypto: xrp ) , finally overcoming his extreme distaste for ...",2025-02-19,33
2 artificial intelligence stocks you can buy and hold for the next decade arm and ambarella deserve just as much attention as nvidia.,2025-02-19,33
"prediction: 1 ai stock will be worth more than apple stock by year-end in 2026 currently, apple is the most valuable publicly listed company in the world, with a market capitalization of $3.6 trillion as of feb. 17. but i think amazon ( nasdaq: amzn ) will top that figure before the year's end in 2026.amazon is currently a $2.4 trillion company.",2025-02-19,33
"meet the cheapest stock in the ""magnificent seven"" right now. is it a buy? if you're a fan of westerns, you may think of the silver screen when someone says the magnificent seven -- a film by the name came out in 1960. but the name also refers to a group of stocks that have powered index gains through this bull market so far.",2025-02-19,33
