cleaned_text,timestamp,days_elapsed,ticker
"2 incredible growth stocks i'm buying hand over fist u.s. stocks have recently come under pressure following president trump's pivot toward more protectionist economic policies. however, seasoned long-term investors recognize that these sharp market pullbacks often present compelling buying opportunities.with this principle in mind, i'm ...",2025-03-24 12:30:00,2,GOOG
where will ionq stock be in 1 year? ionq stock has emerged as a fan favorite among a sea of popular quantum computing stocks.,2025-03-24 12:15:00,2,GOOG
rumble stock: a millionaire-maker in the making? this relatively young company is making a run on behemoth youtube's control of the video-sharing space.,2025-03-24 10:30:00,2,GOOG
"medical imaging reagents market to reach us$ 32.4 bn by 2035, driven by innovations in precision imaging and diagnostic advancements | transparency market research wilmington, delaware, transparency market research inc. -, march 24, 2025 ( globe newswire ) -- the global medical imaging reagents market, projected to reach us$ 32.4 billion by 2035 from its 2024 valuation of us$ 19.2 billion, is advancing steadily at a cagr of 4.8%.",2025-03-24 10:18:43,2,GOOG
"meta profits from llama ai models despite denials, court filing reveals - alphabet  ( nasdaq:goog ) , dell technologies  ( nyse:dell )  meta platforms inc. meta has reportedly been discovered to be profiting from its llama ai models through revenue-sharing agreements with host businesses. what happened: an unredacted court filing submitted by attorneys for the plaintiffs in the copyright lawsuit kadrey v.",2025-03-24 08:42:18,2,GOOG
"want to invest in quantum computing? 2 stocks that are great buys right now. the next big game-changing technology could be the ticket to explosive gains for your portfolio over time. and that technology may be quantum computing, a type of computing that aims to solve today's impossible problems.",2025-03-24 08:15:00,2,GOOG
"3 essential ai infrastructure stocks to buy right now recent tariffs and trade restrictions under president donald trump's administration have temporarily cooled the artificial intelligence ( ai ) - fueled bull market, with the benchmark s&p 500 retreating 3.6% since the start of the year.",2025-03-23 18:00:00,3,GOOG
"the smartest stocks to buy with $1,000 in the nasdaq correction there are several ways to approach a market correction. one would be to resort to panic selling, which is usually a bad idea. alternatively, investors can take the opportunity to buy shares of top companies on the dip.",2025-03-23 10:45:00,3,GOOG
"the smartest growth stock to buy with $3,000 right now it may surprise some people that amazon ( nasdaq: amzn ) retains high growth potential after years of high revenue increases. the company conducted its initial public offering in 1997 at a split-adjusted price of about 8 cents, it currently trades near $200, and it has a more than $2 trillion ...",2025-03-23 09:35:00,3,GOOG
"2 ""magnificent seven"" stocks to buy on the dip buying shares of industry leaders that are drowning in cash is a simple but effective long-term investment strategy. winners tend to keep on winning, and with that in mind, investors might want to consider using the market sell-off to add a few ""magnificent seven"" stocks to their portfolio.these ...",2025-03-23 08:30:00,3,GOOG
"could netflix stock help you retire a millionaire? there are few businesses that have taken care of investors the way netflix ( nasdaq: nflx ) has. since the company's initial public offering in 2002, shares have skyrocketed, rising 80,080% ( as of march 19 ) . this means that if you invested a small sum of just $1,250 back then, you would be ...",2025-03-22 18:45:00,4,GOOG
"shaq accidentally invested $250,000 in this company, now its value is skyrocketing: 'my only regret, i wish i would have bought more' shaq's ""accidental"" $250,000 google investment turns into a multimillion-dollar slam dunk. shaq's diverse portfolio highlights the value of investment diversification. feel unsure about the market's next move? copy trade alerts from matt maley-a wall street veteran who consistently finds profits ...",2025-03-22 18:01:18,4,GOOG
"2 hidden ai stocks to buy in the s&p 500 sell-off it's no secret that artificial intelligence ( ai ) -related stocks have sold off in the recent market correction. it's partly due to investors locking in gains, competitive concerns relating to chinese start-up deepseek, and, most notably, valuation concerns.",2025-03-22 11:20:00,4,GOOG
