cleaned_text,timestamp,days_elapsed
"nasdaq correction: buy this unstoppable etf at a discount the nasdaq ( nasdaqindex: ^ixic ) has officially entered correction territory, falling by close to 13% since mid-february, as of this writing. monday marked the index's worst single-day drop since 2022, as it plunged by 4% -- fueling concerns about a looming bear market or recession.the future is ...",2025-03-12,12
"nasdaq sell-off: the 3 best ""magnificent seven"" stocks to buy now the nasdaq has entered correction territory, and just as the so-called ""magnificent seven"" stocks led the market higher during the bull run, these stocks have helped lead the market lower during this recent correction. the ""magnificent seven"" consist of seven leading technology companies: ...",2025-03-11,13
"hedges become profitable, trump stock market put failed - trump has bigger fish to fry - spdr s&p 500  ( arca:spy )  to gain an edge, this is what you need to know today. after the sell off, consider taking partial profits on hedges. aggressive investors may consider nibbling stocks and etfs that are entering buy zones. nibbling simply means entering very, very small tranches in existing recommendations.",2025-03-11,13
"meta taps taiwan semiconductor to build ai chip, aims to cut nvidia dependence by 2026 - meta platforms  ( nasdaq:meta )  meta is testing its first ai training chip to cut nvidia reliance and lower infrastructure costs tied to its ai push. meta tapped tsmc to build its training chips, with plans to deploy them widely by 2026 if testing proves successful. find out which stock just plummeted to the bottom of the new ...",2025-03-11,13
"trump set to meet top executives from apple, jpmorgan and other giants: report - blackrock  ( nyse:blk ) , apple  ( nasdaq:aapl )  u.s. president donald trump is set to meet with the ceos of america's largest corporations on tuesday, amid growing economic concerns and a recent slump in stock values. what happened: trump's meeting with around 100 ceos is part of a regular gathering of the business roundtable in washington.",2025-03-11,13
"the nasdaq just hit correction territory: you won't believe what stock is at a 52-week low already in a slump before monday's tumble, the nasdaq's recent plunge has turned the software giant's stock into an outright bargain.",2025-03-11,13
"apple inc.  ( aapl )  is attracting investor attention: here is what you should know apple (aapl) has been one of the stocks most watched by zacks.com users lately. so, it is worth exploring what lies ahead for the stock.",2025-03-11,13
"should you buy taiwan semiconductor stock at current prices? taiwan semiconductor manufacturing ( nyse: tsm ) boasts nvidia ( nasdaq: nvda ) and apple ( nasdaq: aapl ) as two of its customers.*stock prices used were the afternoon prices of march 7, 2025. the video was published on march 9, 2025.continue reading ...",2025-03-11,13
"a tale of 2 ai stocks: why broadcom soared even as ""baby broadcom"" plunged last week artificial intelligence stocks have taken a beating over the past month. while ai-fueled enthusiasm caused several stocks to boom in 2024, investors now appear to be experiencing angst over valuations in the face of potential tariffs, trade restrictions to china, or a digestion period in ai ...",2025-03-11,13
"warren buffett rakes in $607 million while elon musk, jeff bezos, and other top moneybags bleed $67 billion in a day amid market wipeout - apple  ( nasdaq:aapl ) , amazon.com  ( nasdaq:amzn )  the world's top tech billionaires saw their fortunes plummet on monday as markets tumbled, with the magnificent seven tech giants shedding approximately $780 billion in market capitalization during a single trading session. what happened: according to the bloomberg billionaires index, tesla inc.",2025-03-11,13
"tesla's 101x valuation raises alarm as gordon johnson warns of sales slump, dan ives sees ai upside despite elon musk's doge distractions - microsoft  ( nasdaq:msft ) , apple  ( nasdaq:aapl )  tesla inc. tsla continues trading at 101 times its 2025 estimated non-gaap earnings while key metrics decline, prompting glj research's gordon johnson to sound alarm on monday as tech stocks face a significant market correction.",2025-03-11,13
"cathie wood stands by 'deflationary boom' call as gene munster compares market turmoil to dot-com bubble - meta platforms  ( nasdaq:meta ) , apple  ( nasdaq:aapl )  ark funds ceo cathie wood forecasts a ""deflationary boom"" as markets tumbled on monday, with the magnificent seven tech stocks shedding approximately $780 billion in market capitalization.",2025-03-11,13
"""r-word"" fears send stock market much lower while the tech-heavy nasdaq and small-cap russell 2000 are both -11% over the past month, the dow is down ""only"" half that.",2025-03-10,14
"2025 march market cap showdown: andy cross vs. matt argersinger it's time for another market cap game show. to catch full episodes of all the motley fool's free podcasts, check out our podcast center. to get started investing, check out our beginner's guide to investing in stocks.",2025-03-10,14
"money flowing out of us stock market into europe, ""a period of transition"" - says trump to gain an edge, this is what you need to know today. please click here for a chart comparing spdr s&p 500 etf trust ( spy ) which represents the benchmark stock market index s&p 500 ( spx ) , select stoxx europe aerospace & defense etf ( euad ) , and spdr euro stoxx 50 etf ( fez ) .",2025-03-10,14
"stock market news for mar 10, 2025 wall street closed higher on friday, pulled up by tech and energy stocks.",2025-03-10,14
"meet the unstoppable artificial intelligence  ( ai )  stock that could join the $3 trillion club by 2028 artificial intelligence is already improving this business' financial results, but there could be a lot more to come.",2025-03-09,15
"3 etfs to buy now for passive dividend income with volatility spiking and stock market indexes like the s&p 500 ( snpindex: ^gspc ) and nasdaq composite ( nasdaqindex: ^ixic ) down on the year, investors may be looking for ways to diversify their portfolios and collect some passive income.exchange-traded funds ( etfs ) are one way to invest ...",2025-03-09,15
"2 reasons the tech sell-off could be a great buying opportunity for ai stock investors less than three months after the nasdaq composite ( nasdaqindex: ^ixic ) set an all-time high, the tech-heavy index is on the verge of entering a correction, which is typically defined is a pullback of 10% or more from a recent peak.in fact, on an intraday basis, the index was down more than 10% ...",2025-03-09,15
"consumer tech news  ( mar 3-mar 7 ) : discord may initiate ipo, apple's new macbook air with m4 chip, tencent' yuanbao ai surpassed deepseek as most downloaded & more - alphabet  ( nasdaq:goog ) , apple  ( nasdaq:aapl )  trump slams uk for demanding apple create an encryption backdoor, comparing it to china's surveillance. tim cook teases a new ""air"" product, sparking speculation on a macbook air refresh or a new device. every week, our whisper index uncovers five overlooked stocks with big breakout potential.",2025-03-08,16
"25% of warren buffett-led berkshire hathaway's $288 billion portfolio is invested in only 1 stock warren buffett is responsible for putting up tremendous returns as ceo of berkshire hathaway. but maybe his most lucrative bet came in the past decade, when the conglomerate purchased shares in a business that has put up a monster 900% total return since the start of 2016 ( as of march 4 ) .even ...",2025-03-08,16
"could apple be a millionaire-maker stock? during its rise to become a dominant tech enterprise, apple ( nasdaq: aapl ) has certainly made its early investors some serious money. in the past two decades, shares have generated a total return of greater than 18,000%, boosted by the introduction of popular hardware devices and services.if ...",2025-03-08,16
3 reasons tech investors shouldn't worry too much about tumbling artificial intelligence  ( ai )  stocks this week technology investors had gotten used to a good thing -- positive momentum that seemed unstoppable. giants in the industry led the nasdaq to two years of double-digit gains -- and the individual stocks themselves offered shareholders mind-boggling returns.,2025-03-08,16
"apple  ( aapl )  beats stock market upswing: what investors need to know in the most recent trading session, apple (aapl) closed at $239.07, indicating a +1.59% shift from the previous trading day.",2025-03-07,17
"stock market dodges jobs report bullet, crypto reserve details disappoint, germany may go nuclear to gain an edge, this is what you need to know today. please click here for an enlarged chart of spdr s&p 500 etf trust ( spy ) which represents the benchmark stock market index s&p 500 ( spx ) . the 200 day moving average is very powerful, and all investors should pay attention to it.",2025-03-07,17
"38% of berkshire hathaway's portfolio is invested in these 3 unstoppable dividend stocks there are several things warren buffett is known for as an investor. first, the oracle of omaha has consistently emphasized the importance of having a long-term mindset when investing in stocks. second, he famously loves dividends.it's therefore no surprise that the company he chairs, berkshire ...",2025-03-07,17
"law of unintended consequences hitting stock market, french nuclear weapons to defend europe - spinnaker etf series select stoxx europe aerospace & defense etf  ( bats:euad )  to gain an edge, this is what you need to know today. please click here for a chart of german bunds ( bund ) . bunds are german government bonds. it is important for investors to set their politics aside, go to neutral to examine events without bias.",2025-03-06,18
"why now is the best time to invest in netflix & sony stocks netflix & sony thrive in the subscription boom, fueled by streaming & gaming growth, with strong ties to apple's ecosystem.",2025-03-06,18
should ishares russell top 200 growth etf  ( iwy )  be on your investing radar? style box etf report for ...,2025-03-06,18
apple's latest macbook air with m4 chip is twice as fast as its predecessor with lower price - apple  ( nasdaq:aapl )  m4 chip boosts macbook air's performance by up to 2x. macbook air now supports two 6k external displays. our government trade tracker caught pelosi's 169% ai winner. discover how to track all 535 congress member stock trades today.,2025-03-05,19
"want to invest like buffett? this is what he just said he looks for in ""really outstanding businesses,"" and it may not be what you think warren buffett has earned his reputation as one of the greatest investors ever. he has led his holding company, berkshire hathaway, to incredible market-beating returns. as of the end of last year, berkshire hathaway's market value per share has increased 5,502,284% since buffett took over, while ...",2025-03-05,19
"earphones and headphones market to reach usd 218278.0 million by 2032, growing at a 13.20% cagr - credence research pune, india, march 5, 2025 /prnewswire/ -- the global earphones and headphones market was valued at usd 71,514.2 million in 2023 and is projected to grow significantly over the next decade.",2025-03-05,19
"this once-unstoppable low-cost vanguard etf is underperforming the s&p 500 in 2025. here's why it's a buy now. technology stocks like nvidia ( nasdaq: nvda ) , apple ( nasdaq: aapl ) , and microsoft ( nasdaq: msft ) have increased by severalfold over the last decade -- helping drive the s&p 500 ( snpindex: ^gspc ) to new heights. but year to date, tech has been one of the worst-performing stock market ...",2025-03-05,19
should ishares core s&p 500 etf  ( ivv )  be on your investing radar? style box etf report for ...,2025-03-05,19
"trump's says 'little disturbance' possible due to tariffs in speech to congress as gm, tesla, energy stocks lift in after-hours trading: 'auto industry to absolutely boom' - apple  ( nasdaq:aapl ) , bp  ( nyse:bp )  president donald trump's congressional address triggered significant after-hours market movements across a wide range of stocks. taiwan semiconductor mfg. co. tsm rose 0.77% to $181.38, while apple inc. aapl increased 0.72% to $237.63. oracle corp.",2025-03-05,19
"taiwan semiconductor rises as $100 billion u.s. expansion defies market downturn - taiwan semiconductor  ( nyse:tsm )  taiwan semiconductor is investing an additional $100 billion in u.s. chip manufacturing, bringing its total u.s. commitment to $165 billion. the investment includes new fabrication plants and r&d facilities, aiming to boost u.s. chip production and solidify tsm's dominance.",2025-03-04,20
"february's 20 most-searched tickers on pro - where do tesla, palantir, alibaba, nvidia stocks rank? - apple  ( nasdaq:aapl ) , firefly neuroscience  ( nasdaq:aiff )  a look at the top 20 most-searched tickers on benzinga pro in the month of january. several of the names are popular tickers with some lesser known, high-moving stocks making this month's list. every week, our whisper index uncovers five overlooked stocks with big breakout potential.",2025-03-04,20
"investors shouldn't 'run to the hills' over tariffs: dan ives points to 8 ai stocks 'to own' - apple  ( nasdaq:aapl ) , amazon.com  ( nasdaq:amzn )  technology stocks are falling tuesday on fears from the tariffs on mexico, canada and china. tech analyst dan ives sees the pullback as a buying opportunity. our government trade tracker caught pelosi's 169% ai winner. discover how to track all 535 congress member stock trades today.",2025-03-04,20
"raising cash and hedges, pay attention to stock market support zone trump's speech to gain an edge, this is what you need to know today. it is time to raise cash and hedges. for details, please see the section below titled ""protection band and what to do now."". there are a number of triggers for this call that include ism data and president trump following through with tariffs.",2025-03-04,20
"sirius xm plunges 42.3% in a year: how should you play the stock? siri expands content and improves engagement, but with falling subscription revenues and strong competition, investors can wait for better entry points.",2025-03-04,20
"best buy revenue upbeat, health drags best buy surpassed earnings expectations for its fourth quarter, but faced challenges in its health division.",2025-03-04,20
why visa & paypal are must-buy stocks in apple's cashless revolution investors looking to capitalize on apple's digital payments revolution may consider buying visa and paypal.,2025-03-04,20
"3 dividend stock etfs to buy with $2,000 and hold forever there is no shortage of excellent, low-cost exchange-traded funds ( etfs ) that specialize in dividend stocks. there are some that focus on stocks that pay above-average dividends, stocks whose dividends grow rapidly, and dividend-paying stocks that have certain characteristics in common.",2025-03-04,20
"apple stock investors: here's what you need to know apple ( nasdaq: aapl ) boasts one of the highest customer satisfaction ratings of any company.*stock prices used were the afternoon prices of feb. 27, 2025. the video was published on march 1, 2025.continue reading ...",2025-03-04,20
"which will win the race to $5 trillion: apple or nvidia stock? although the world has never seen a $5 trillion company, there is a competitive race between apple ( nasdaq: aapl ) and nvidia ( nasdaq: nvda ) . apple has a large lead with its $3.6 trillion market cap, but nvidia isn't far behind with a $3 trillion market cap.",2025-03-04,20
is flexshares quality dividend etf  ( qdf )  a strong etf right now? smart beta etf report for ...,2025-03-04,20
"warren buffett just sold 4 bank stocks, but hasn't unloaded a single share of these 2 warren buffett has been a fan of the banking industry for many years. out of the roughly 40 stocks in berkshire hathaway's ( nyse: brk.a ) ( nyse: brk.b ) closely watched portfolio, six of them are banks -- including two of the three largest positions.however, berkshire has significantly reduced ...",2025-03-04,20
"2 magnificent warren buffett stocks that make for screaming buys in march, and 1 to avoid two historically inexpensive stocks in berkshire hathaway's $297.5 billion portfolio are ripe for the picking, while the oracle of omaha's top holding is sending all the wrong signals.",2025-03-04,20
"apple's $500 billion investment in america: is the stock a buy? the reshoring of manufacturing to north america is becoming a huge theme throughout corporate america. whether their management teams are acting to avoid the impact of tariffs or because it makes sense to them on broader business and geopolitical levels, numerous companies recently made major ...",2025-03-04,20
"markets pull back late on new tariff talk today's fall was steady and modest until this afternoon, when it was announced +25% tariffs are indeed being levied onto our direct neighbors canada and mexico.",2025-03-03,21
"buy taiwan semiconductor  ( tsm )  stock for expansion plans in the u.s.? taiwan semiconductor (tsm) is making headlines on monday, with the chip giant set to invest $100 billion for manufacturing plants in the united states.",2025-03-03,21
"berkshire hathaway hits $1.07 trillion market cap, surpassing tesla - earnings shock and tesla's decline highlight changing markets - apple  ( nasdaq:aapl ) , amazon.com  ( nasdaq:amzn )  on monday, warren buffett's berkshire hathaway brk brk.b ) ) pulled ahead of elon musk's tesla tsla in market value, showing just how much earnings matter in the stock market.",2025-03-03,21
"the ""apple of public safety"" axon enterprise is facing new questions about its competition, but the earnings continue to look strong.",2025-03-03,21
"warren buffett's state of the market berkshire's cash hoard is approaching ""dr. evil"" levels.",2025-03-03,21
"rule breaker investing mailbag: simple stocks peter lynch taught us to buy what we know. can successful investing be that simple? and if we know and love the companies we own, how should we go about selling them? how are we supposed to remember why we bought these stocks in the first place?",2025-03-03,21
warren buffett is still holding his apple stock: should you? warren buffett has stopped trimming his apple ( nasdaq: aapl ) position. the billionaire from omaha kept his largest position for berkshire hathaway unchanged in the fourth quarter after dumping most of his ownership in the first three quarters of 2024.,2025-03-03,21
"prediction: 3 stocks that'll be worth more than apple 5 years from now apple ( nasdaq: aapl ) is the world's largest company by market capitalization, so it takes a lot for companies to surpass it in terms of valuation. however, i think that it's possible. the number of companies in a position to pass apple is relatively few, based solely on apple's sheer $3.6 ...",2025-03-03,21
"warren buffett has sold over 950 million shares of apple and bank of america. but the billionaire has made a killing on 1 stock he hasn't touched in 27 years 2024 turned out to be a bit of an odd year for warren buffett and his company berkshire hathaway ( nyse: brk.a ) ( nyse: brk.b ) . berkshire's stock performed well, with class b shares generating a 27% return and beating the broader market's 23% return.however, buffett made many moves indicating ...",2025-03-03,21
is ishares msci usa quality factor etf  ( qual )  a strong etf right now? smart beta etf report for qual ...,2025-03-03,21
"berkshire hathaway's ""extraordinary cash position"" is no big deal, according to warren buffett every year, investors eagerly await berkshire hathaway's ( nyse: brk.a ) ( nyse: brk.b ) annual report. the highlight is warren buffett's shareholder letter, in which he shares his folksy wisdom about investing and the company he heads.",2025-03-03,21
"google and china's honor deepen ai partnership as huawei spin-off takes on apple and samsung with $10 billion investment - alphabet  ( nasdaq:goog ) , apple  ( nasdaq:aapl )  honor has ramped up its ai ambitions with a $10 billion investment over the next five years, alongside a deeper partnership with alphabet inc.'s goog googl google, as it looks to compete with apple inc. aapl and samsung electronics co. ssnlf in the global smartphone market.",2025-03-03,21
"apple's ai crisis: falling behind in the ai race? - amazon.com  ( nasdaq:amzn )  apple races against time as siri's next upgrade in may becomes a make-or-break moment in the ai feud. amazon's alexa+ leapfrogs apple's siri, revealing a stark gap in the tech giant's ai capabilities. every week, our whisper index uncovers five overlooked stocks with big breakout potential.",2025-03-02,22
"how are 9 out of the 11 stock market sectors outperforming the s&p 500 in 2025? there are plenty of ways to categorize stocks. some investors think of growth stocks versus value or dividend stocks. or megacap, large-cap, mid-cap, and small-cap if you sort by market capitalization. there's also a more formal organization technique based on stock market sectors.according to ...",2025-03-02,22
"$21 trillion wealth-creating stocks are still undervalued - three big bargains to buy now - apple  ( nasdaq:aapl ) , amazon.com  ( nasdaq:amzn )  with economic moats and innovative technologies, these top-performing stocks offer a potential bargain for long-term investors. every week, our whisper index uncovers five overlooked stocks with big breakout potential. get the latest picks today before they gain traction.",2025-03-02,22
"wall street is shying away from the 'mag-7' as $1.4 trillion in value leaks out - apple  ( nasdaq:aapl ) , amazon.com  ( nasdaq:amzn )  tech giants that have dominated wall street for two years are losing their grip, with the so-called magnificent seven stocks shedding about $1.4 trillion in market value since december, bloomberg reported tuesday.",2025-03-01,23
"buffett's on the sidelines - should you follow? - apple  ( nasdaq:aapl ) , american express  ( nyse:axp )  warren buffett and berkshire hathaway ( nyse: brk-a ) always make headlines in february when the firm holds its annual meeting. among the many takeaways is what the company has been buying and selling and how invested it is in the market.",2025-02-28,24
"tesla: the only magnificent seven stock in freefall - can it reverse course? - tesla  ( nasdaq:tsla )  tesla is the worst-performing mag 7 stock in 2024, down 30.18% year to date, with bearish technical signals. tesla's high p/e and lagging revenue growth contrast sharply with nvidia and meta's stronger fundamentals and momentum. every week, our whisper index uncovers five overlooked stocks with ...",2025-02-28,24
"netflix poised to beat youtube video revenues: time to buy the stock? nflx is poised to surpass youtube in 2025 revenues. with strong subscriber growth and a booming ad business, this streaming leader is poised for massive gains.",2025-02-28,24
"marjorie taylor greene goes shopping; here are 6 stocks she just bought while there's speculation that rep. marjorie taylor greene, the republican congresswoman from georgia, may be considering a run for governor or the u.s. senate, she's not losing focus on building out her investment portfolio.",2025-02-28,24
"great news for apple stock investors apple ( nasdaq: aapl ) stock investors are cautiously increasing their optimism about the company's prospects.*stock prices used were the afternoon prices of feb. 25, 2025. the video was published on feb. 27, 2025.continue reading ...",2025-02-28,24
warren buffett's actions  ( or lack thereof )  with his favorite stock speak volumes -- but are investors paying attention? a good deal is becoming tougher to come by on wall street.,2025-02-28,24
"tesla stock vs. apple stock: billionaires buy one and sell the other tesla ( nasdaq: tsla ) and apple ( nasdaq: aapl ) were two of the three most popular stocks among retail investors last year, according to vanda research. but two hedge fund billionaires bought tesla and sold apple during the fourth quarter, as detailed below:to reiterate, the trades listed above ...",2025-02-28,24
"cathie wood sells off spotify stock as youtube clamors for podcast crown - apple  ( nasdaq:aapl ) , ark next generation internet etf  ( arca:arkw )  on thursday, cathie wood's ark invest made a significant trade involving spotify technology sa spot. ark invest's decision to trade spotify's shares comes amidst a turbulent time for the music streaming giant.",2025-02-28,24
"february fever: retail investors 'buy-the-dip' as hedge funds rebuild magnificent seven bets - invesco qqq trust, series 1  ( nasdaq:qqq ) , proshares ultrapro qqq  ( nasdaq:tqqq )  retail investors poured $79 billion into equity etfs in february, continuing their aggressive 'buy the dip' strategy. hedge funds are quietly rebuilding mag 7 positions after trimming exposure in late 2024. every week, our whisper index uncovers five overlooked stocks with big breakout potential.",2025-02-27,25
"prediction: this artificial intelligence  ( ai )  stock -- a 1,020% gainer since its ipo -- won't split its stock in 2025. here's why palantir stock is up by more than 1,000% in less than five years.",2025-02-27,25
"market to navigate nvidia post-earnings analysis, key economic events - nvidia  ( nasdaq:nvda )  good morning traders! in today's market clubhouse morning memo, we will discuss spy, qqq, aapl, msft, nvda, googl, meta, and tsla. our proprietary formula, exclusive to market clubhouse, dictates these price levels. this dynamic equation takes into account price, volume, and options flow.",2025-02-27,25
warren buffett's annual letter shares 4 of the most chilling words investors will ever witness one of wall street's most unwavering long-term optimists just bluntly leveled with investors.,2025-02-27,25
