title,summary,time_published
"Deploy Cash And Reduce Hedges, Powerful Market Mechanics And Trump Tariffs Control The Stock Market","To gain an edge, this is what you need to know today. This change is primarily triggered by a combination of powerful market mechanics and President Trump's tariff shift. Keep in mind that this change may need to be quickly reversed if President Trump changes his mind.",20250324T155434
Motley Fool 2025 March Market Cap Showdown Championship,"It all comes down to this...the final round of the Motley Fool Rule Breaker Investing March Market Cap Showdown! Defending Champion Andy Cross has held off all contenders and pretenders, but game show survivor Emily Flippen is not one to back down from a challenge. Who will win the crown for 2025?",20250324T154100
"In-Depth Analysis: Apple Versus Competitors In Technology Hardware, Storage & Peripherals Industry - Apple  ( NASDAQ:AAPL ) ","In today's rapidly changing and highly competitive business world, it is imperative for investors and industry observers to carefully assess companies before making investment choices.",20250324T150050
"Tech Sector To See Major Impact from Tariffs and Tesla's Delivery Numbers, Predicts Top Analyst: Calls April 2 As The 'Vortex Day' - Apple  ( NASDAQ:AAPL ) , Amazon.com  ( NASDAQ:AMZN ) ","Gene Munster, managing partner at Deepwater Asset Management, has expressed concern over the potential impact of new tariffs on the tech sector, particularly on ""Mag Seven"" stocks.",20250324T133730
What's hot in ETFs? Bond funds are in demand as investors flee the Nasdaq 'QQQ',"There have been strong inflows into fixed income, especially ultrashort funds. Precious metal funds have seen surprisingly light inflows.",20250324T132442
Investors Heavily Search Apple Inc.  ( AAPL ) : Here is What You Need to Know,"Recently, Zacks.com users have been paying close attention to Apple (AAPL). This makes it worthwhile to examine what the stock has in store.",20250324T130011
Best Health & Fitness Stocks to Buy for Strong Growth,"The health and fitness boom is fueling demand for gyms, nutrition, and wellness services. Stocks like LTH, WW, SFM, and BYND are well-positioned to benefit.",20250324T125400
Buy 3 Janus Henderson Mutual Funds for a Growth Portfolio,"Invest in Janus Henderson mutual funds like JNRFX, JNGLX and JDMAX for solid returns.",20250324T113200
Should iShares Russell Top 200 ETF  ( IWL )  Be on Your Investing Radar?,Style Box ETF report for ...,20250324T102006
Should FlexShares US Quality Large Cap ETF  ( QLC )  Be on Your Investing Radar?,Style Box ETF report for ...,20250324T102006
Is Fidelity Quality Factor ETF  ( FQAL )  a Strong ETF Right Now?,Smart Beta ETF report for ...,20250324T102005
"Apple's iPhone 18 To Get Massive Boost With 2nm A20 Chip: TSMC's Yields Surge Past 70%, Says Analyst Ming-Chi Kuo - Taiwan Semiconductor  ( NYSE:TSM ) ","Apple Inc.'s AAPL upcoming iPhone 18 lineup is expected to feature Taiwan Semiconductor Mfg. Co. Ltd.'s TSM 2nm A20 chip, according to a top supply chain analyst.",20250324T100515
Apple Stock Has a Growth Problem. Is It Really Worth Its Premium Valuation?,Investors are hoping AI will come to rescue the tech giant's underwhelming top line.,20250324T084100
Want to Invest in Quantum Computing? 2 Stocks That Are Great Buys Right Now.,"The next big game-changing technology could be the ticket to explosive gains for your portfolio over time. And that technology may be quantum computing, a type of computing that aims to solve today's impossible problems.",20250324T081500
"China Courts Apple, Pfizer, Eli Lilly Amid US Pressure, Vice Premier Says Beijing 'Will Continue To Improve The Business Environment' - Apple  ( NASDAQ:AAPL ) , Eli Lilly  ( NYSE:LLY ) ","On Sunday, Chinese Vice Premier He Lifeng met with top executives from Apple Inc. AAPL, Pfizer Inc. PFE, Mastercard Inc. MA, Eli Lilly and Co. LLY, Cargill, and other major firms.",20250324T013953
Apple Explores AI Wearables With Camera-Integrated Smartwatches - Apple  ( NASDAQ:AAPL ) ,"Visual Intelligence feature leaps from iPhone to wrist, as Apple Watches gear up to scan and interpret the world around you. Apple's upcoming watches aim to blend high-tech surveillance with everyday convenience by 2027. Volatility can create massive trading opportunities-if you know how to ...",20250323T154916
"Google's AI Sprint, OpenAI Legal Drama, Nvidia's AI Innovations, And AI Bubble Concerns: This Week In Artificial Intelligence - Apple  ( NASDAQ:AAPL ) , Amazon.com  ( NASDAQ:AMZN ) ","The past week has been a rollercoaster ride in the world of artificial intelligence ( AI ) . From Google's ambitious 100-day AI sprint to OpenAI's legal troubles, Nvidia's AI advancements, and concerns over an AI bubble, the industry has seen it all. Let's dive into the details.",20250323T132018
"Apple's Siri AI Crisis, Security Flaws, And China Sales Woes: This Week In Appleverse - Apple  ( NASDAQ:AAPL ) ","The past week has been a rollercoaster for Apple Inc. AAPL, with the tech giant facing a series of challenges from internal turmoil to security oversights. The company's stock has taken a hit, falling over 12% this year.",20250323T110119
2 Millionaire-Maker Technology Stocks to Buy,"When it comes to looking for millionaire-making tech stocks, your best bet is to try to find small to mid-sized growth companies that have big potential. After all, a stock would need to go up 100x to turn a $10,000 investment into a $1 million.While these type of investment gains do occur, they ...",20250323T091500
"The Best Warren Buffett Stocks to Buy With $2,000 Right Now","The S&P 500 is down more than 7% over the past month ( as of this writing ) , inching closer to correction territory. Investors are generally concerned about President Donald Trump's tariffs igniting trade wars and, as a result, the potential for the U.S. economy to slow down significantly.That's ...",20250322T201300
Should You Buy Berkshire Hathaway While It's Below $550?,"While the stock market has been selling off recently, one stock that has bucked the trend is Berkshire Hathaway ( NYSE: BRK.B ) ( NYSE: BRK.A ) . Its shares are up more than 15% year to date as of this writing, and the stock is trading near an all-time high.Let's look at why Berkshire has ...",20250322T180500
"Bulls And Bears: Tesla, Nvidia, FedEx - And The Market Digests The Fed's Rate Decision Bulls And Bears: Tesla, Nvidia, FedEx - And The Market Digests The Fed's Rate Decision - Apple  ( NASDAQ:AAPL ) ","Benzinga examined the prospects for many investors' favorite stocks over the last week - here's a look at some of our top stories. Markets ended the week mixed, with the S&P 500 and Dow slipping while the Nasdaq notched a slight gain, buoyed by strength in tech. Tesla Inc.",20250322T120118
3 Stocks Warren Buffett Just Bought,"When the stock market falls, investors can always find encouragement to stay the course by seeing relatively low portfolio turnover at Warren Buffett's Berkshire Hathaway. Berkshire had held large positions in several stocks for years.",20250322T120000
"Meet the Spectacular Vanguard ETF With 43.2% of Its Portfolio Invested in Nvidia, Amazon, Apple, and Microsoft","The S&P 500 ( SNPINDEX: ^GSPC ) has only delivered back-to-back annual gains of 25% or more ( including dividends ) on two occasions in its history dating back to 1957: during the dot-com internet boom in 1997 and 1998, and during the artificial intelligence ( AI ) boom in 2023 and 2024.",20250322T082600
"Sam Altman-Led OpenAI Faces Legal Action Over ChatGPT 'Hallucination' That Accused Man Of Murder - Alphabet  ( NASDAQ:GOOG ) , Apple  ( NASDAQ:AAPL ) ","A Norwegian man has taken legal action against Sam Altman-led OpenAI alleging that ChatGPT falsely claimed he murdered his children. What Happened: Arve Hjalmar Holmen discovered the alleged fabrication after asking ChatGPT, ""Who is Arve Hjalmar Holmen?""",20250322T060506
"3 Beloved Stocks Warren Buffett Is Dumping As Markets Fall - Apple  ( NASDAQ:AAPL ) , American Express  ( NYSE:AXP ) ","The Sage of Omaha is laying low and lopping off once-favored stocks. Here are the three most telling stocks Warren Buffet has been selling, and why. Feel unsure about the market's next move? Copy trade alerts from Matt Maley-a Wall Street veteran who consistently finds profits in volatile ...",20250321T214408
NVDA's Magic Buyback Signals Confidence - Time to Buy the Stock?,"If NVIDIA continues its aggressive buybacks alongside its AI-driven revenue explosion, investors could see significant appreciation in the stock price.",20250321T163600
"SNCR Jumps 28% in a Month: Should You Buy, Sell or Hold the Stock?",Synchronoss's prospects benefit from cloud expansion and AI innovation amid stiff competition.,20250321T155400
"Assessing Apple's Performance Against Competitors In Technology Hardware, Storage & Peripherals Industry - Apple  ( NASDAQ:AAPL ) ","In today's rapidly changing and fiercely competitive business landscape, it is vital for investors and industry enthusiasts to carefully evaluate companies. In this article, we will perform a comprehensive industry comparison, evaluating Apple AAPL against its key competitors in the Technology ...",20250321T150052
Severance's Fame is Good for Apple TV+: Is it True for AAPL Stock?,"Severance's success bodes well for Apple's Services business. However, Apple Intelligence delays, stretched valuation, and China headwinds are concerns in 2025.",20250321T141600
How High Or Low Can The SPY Go Today? - SPDR S&P 500  ( ARCA:SPY ) ,"Good Morning Traders! In today's Market Clubhouse Morning Memo, we will discuss SPY, QQQ, AAPL, MSFT, NVDA, GOOGL, META, and TSLA. Our proprietary formula, exclusive to Market Clubhouse, dictates these price levels. This dynamic equation takes into account price, volume, and options flow.",20250321T130627
"Jeff Bezos And Nvidia-Backed Perplexity AI Eyes $18 Billion Valuation In New Funding Round - Doubling In Just 4 Months - Apple  ( NASDAQ:AAPL ) , Amazon.com  ( NASDAQ:AMZN ) ","Perplexity, backed by Amazon.com Inc. AMZN founder Jeff Bezos and Nvidia Corp. NVDA is reportedly in talks to raise up to $1 billion in a new funding round that would value the company at $18 billion-double its valuation just four months ago.",20250321T103933
Is Schwab Fundamental U.S. Large Company ETF  ( FNDX )  a Strong ETF Right Now?,Smart Beta ETF report for ...,20250321T102004
"The Zacks Analyst Blog Highlights Apple, Meta Platforms, Chevron, Taylor Devices and GSI Technology","Apple, Meta Platforms, Chevron, Taylor Devices and GSI Technology are included in this Analyst Blog.",20250321T085500
"Apple TV+ Bleeding Over $1 Billion Yearly As Streaming War Heats Up: Report - Apple  ( NASDAQ:AAPL ) , Amazon.com  ( NASDAQ:AMZN ) ","The streaming service of Apple Inc. AAPL, Apple TV+, is reportedly incurring annual losses exceeding $1 billion. What Happened: Since its 2019 launch, Apple has been allocating over $5 billion annually to content for Apple TV+. However, this budget was cut by around $500 million last year.",20250321T064232
"Perplexity Can Make 'Apple Intelligence Work' Says CEO Aravind Srinivas As iPhone Maker Attracts Criticism On Siri And AI Delays - Apple  ( NASDAQ:AAPL ) , Amazon.com  ( NASDAQ:AMZN ) ","Perplexity AI CEO Aravind Srinivas said on Thursday that ""Perplexity will make Apple Intelligence work,"" responding to a social media post suggesting the artificial intelligence startup should replace Siri on iPhones. What Happened: The comment comes as Apple Inc.",20250321T034527
"Apple Stock Down Over 12% This Year - Now Tim Cook Is Reportedly Betting On Vision Pro's Mike Rockwell To Fix Siri After Losing Confidence In AI Boss John Giannandrea - Alphabet  ( NASDAQ:GOOG ) , Apple  ( NASDAQ:AAPL ) ","Apple Inc. AAPL has been facing mounting pressure from investors and competitors. On Thursday, CEO Tim Cook reportedly reshuffled its AI leadership to revive the struggling Siri assistant and catch up in the generative AI race.",20250321T014536
Apple  ( AAPL )  Dips More Than Broader Market: What You Should Know,"In the latest trading session, Apple (AAPL) closed at $214.10, marking a -0.53% move from the previous day.",20250320T214515
"Top Research Reports for Apple, Meta Platforms & Chevron","Today's Research Daily features new research reports on 16 major stocks, including Apple Inc. (AAPL), Meta Platforms, Inc. (META) and Chevron Corporation (CVX), as well as two micro-cap stocks Taylor Devices, Inc. (TAYD) and GSI Technology, Inc. (GSIT).",20250320T213400
"Nvidia's First Quantum Computing Day, $4.5T Quad Witching, European Banks Beat Tech Stocks By 34%","To gain an edge, this is what you need to know today. Please click here for an enlarged chart comparing Nasdaq 100 ETF Invesco QQQ Trust Series 1 ( QQQ ) to European financials ETF iShares MSCI Europe Financials ETF ( EUFN ) . When 2025 started, investors were rushing headlong to buy ...",20250320T165958
"Understanding Apple's Position In Technology Hardware, Storage & Peripherals Industry Compared To Competitors - Apple  ( NASDAQ:AAPL ) ","In the dynamic and fiercely competitive business environment, conducting a thorough analysis of companies is crucial for investors and industry enthusiasts. In this article, we will perform an extensive industry comparison, evaluating Apple AAPL in relation to its major competitors in the ...",20250320T150052
How To Trade SPY Ahead Of Triple Witching? - SPDR S&P 500  ( ARCA:SPY ) ,"Good Morning Traders! In today's Market Clubhouse Morning Memo, we will discuss SPY, QQQ, AAPL, MSFT, NVDA, GOOGL, META, and TSLA. Our proprietary formula, exclusive to Market Clubhouse, dictates these price levels. This dynamic equation takes into account price, volume, and options flow.",20250320T125602
2 Leading Tech Stocks to Buy in 2025,"They say a rising tide lifts all boats. Well, the reverse is true, too: A falling tide lowers all boats. As it is in the water, so it is in the stock market. Case in point: As of this writing, the tech-heavy Nasdaq Composite ( NASDAQINDEX: ^IXIC ) has fallen by more than 9% year to date.",20250320T121000
Should TCW Transform 500 ETF  ( VOTE )  Be on Your Investing Radar?,Style Box ETF report for VOTE ...,20250320T102006
Should Vanguard Growth ETF  ( VUG )  Be on Your Investing Radar?,Style Box ETF report for VUG ...,20250320T102006
Is FlexShares Morningstar U.S. Market Factor Tilt ETF  ( TILT )  a Strong ETF Right Now?,Smart Beta ETF report for TILT ...,20250320T102006
Is FlexShares US Quality Large Cap ETF  ( QLC )  a Strong ETF Right Now?,Smart Beta ETF report for ...,20250320T102005
Could Buying Apple Today Set You Up for Life?,"Every investor has heard of Apple ( NASDAQ: AAPL ) . The consumer tech juggernaut has worked out to be a fantastic investment. Its share price has catapulted a jaw-dropping 14,460% in the past 20 years ( as of March 17 ) .",20250320T100500
"Up Over 50% in 2025, Is Alibaba Stock a Buy Now?",Alibaba is set for better times in 2025 and beyond.,20250320T091500
"Pebble Founder Echoes Mark Zuckerberg's Concerns, Slams Apple For Making It 'Nearly Impossible' To Build Smartwatches That Work With iPhone - Alphabet  ( NASDAQ:GOOGL ) , Apple  ( NASDAQ:AAPL ) ","Eric Migicovsky, the creator of the original Pebble smartwatch, has said Apple Inc.'s AAPL iOS restrictions stifle innovation and make building third-party wearables a painful uphill battle.",20250320T091313
Will Apple's Slow Artificial Intelligence Rollout Help or Hurt the Stock?,"Artificial intelligence ( AI ) is a huge opportunity for a device maker like Apple ( NASDAQ: AAPL ) to take advantage of. With more than 2.2 billion active Apple devices in the world, if the company can use AI to help create a new income stream for its operations, that can be a huge growth ...",20250320T090100
"Zacks Investment Ideas feature highlights: Tesla, Apple, Nvidia, Meta and Amazon","Tesla, Apple, Nvidia, Meta and Amazon have been highlighted in this Investment Ideas article.",20250320T090000
"Warren Buffett Sold 2 S&P 500 Index Funds Mere Months Before the Correction, but He Doesn't Have a Crystal Ball","Had you invested $1,000 in the Berkshire Hathaway ( NYSE: BRK.A ) ( NYSE: BRK.B ) holding company when Warren Buffett took the helm as CEO in 1965, you would have been sitting on a whopping $44.7 million at the end of 2024. The same investment in the S&P 500 ( SNPINDEX: ^GSPC ) index would have ...",20250320T081800
"How The Smart Money Gets Rich When Markets Crash - Apple  ( NASDAQ:AAPL ) , American Express  ( NYSE:AXP ) ","With markets in an uproar lately, I've been thinking about the lessons we can learn from those rare individuals who don't just survive bear markets - they thrive in them. Today, let's take a look at the extraordinary wealth created by a special breed of investor who sees opportunity where others ...",20250319T185357
"Human-Like Reasoning AI Agents And Robots Are A Big Market For Nvidia, But Nvidia Stock Has A Problem - General Motors  ( NYSE:GM ) , SPDR Gold Trust  ( ARCA:GLD ) ","To gain an edge, this is what you need to know today. Please click here for an enlarged chart of NVIDIA Corp NVDA. Nvidia is doing excellent as a company. There is a disconnect between NVDA stock price and Nvidia as a company. The biggest market of all will be the market for robots.",20250319T164320
"Exploring The Competitive Space: Apple Versus Industry Peers In Technology Hardware, Storage & Peripherals - Apple  ( NASDAQ:AAPL ) ","In today's rapidly changing and fiercely competitive business landscape, it is vital for investors and industry enthusiasts to carefully evaluate companies. In this article, we will perform a comprehensive industry comparison, evaluating Apple AAPL against its key competitors in the Technology ...",20250319T150054
"SNAP Falls 22% in a Year: Should You Buy, Sell or Hold the Stock?","Snap advances in AR and benefits from advertising revenue growth, but competition and regional pressures suggest investors should wait for better entry points in 2025.",20250319T143700
90% Advancing Days Offer a Glimmer of Hope in a Corrective Market,"While the market navigates a complex landscape of geopolitical uncertainty, tariffs, and interest rates, the confluence of robust market breadth signals, historically favorable seasonality, and deeply depressed bullish sentiment offers a compelling narrative for future gains.",20250319T135900
Is This Simple Index Fund a Millionaire Maker?,Wondering if you should look beyond American markets to build your fortune? This widely held international fund offers a few opportunities and several challenges.,20250319T131900
Should Schwab 1000 Index ETF  ( SCHK )  Be on Your Investing Radar?,Style Box ETF report for ...,20250319T102006
Should iShares Russell 1000 Growth ETF  ( IWF )  Be on Your Investing Radar?,Style Box ETF report for ...,20250319T102005
Prediction: Buying This Vanguard ETF Today Will Set You Up for Life,"What's an 11-letter word that begins with ""O"" and aptly describes a stock market pullback like the one we're seeing right now? It's easy: The word is ""opportunity.""Forward-thinking investors should view the current market volatility as a great opportunity. And you don't even have to be a ...",20250319T084500
1 Unstoppable Tech ETF That Could Turn $500 Per Month Into $1 Million Within 30 Years,"Last week, the Nasdaq-100 technology index officially entered correction territory after declining by more than 14% from its recent record high. The index hosts some of the world's largest technology stocks, particularly those at the forefront of the artificial intelligence ( AI ) revolution.",20250319T082100
"Nvidia Loses $420 Billion In Market Capitalization Since DeepSeek Launch, Valuation Hits A 29-Month Low As GTC Fails To Ignite Stock - Apple  ( NASDAQ:AAPL ) , General Motors  ( NYSE:GM ) ","A slew of announcements at the GTC AI Conference in San Jose, California failed to ignite the shares of Nvidia Corp. NVDA on Tuesday as it slipped over 3% in trade. The chipmaker led by Jensen Huang has wiped $420 billion in investor wealth since DeepSeek was launched on Jan. 10, 2025",20250319T081925
Bear of the Day: Globalstar  ( GSAT ) ,"Globalstar (GSAT) stock has plummeted over 30% year to date, and unfortunately, the decline could continue.",20250319T080000
Apple's New Passwords App Left Users Exposed To Phishing Attacks For Months Due To Serious HTTP Flaw - Apple  ( NASDAQ:AAPL ) ,"Security researchers found that the Passwords app introduced with Apple Inc.'s AAPL iOS 18 was using unencrypted HTTP connections, exposing users to potential phishing attacks until a quiet fix was issued.",20250319T043509
Interested in Investing in Micro-Cap Stocks?,Check out this information.,20250319T015800
Here's How Much You Would Have Made Owning Apple Stock In The Last 10 Years - Apple  ( NASDAQ:AAPL ) ,"Apple AAPL has outperformed the market over the past 10 years by 10.59% on an annualized basis producing an average annual return of 20.98%. Currently, Apple has a market capitalization of $3.19 trillion.",20250318T224525
Welcome Back to Correction Territory,"In this podcast, Motley Fool analyst Anthony Schiavone and host Ricky Mulvey discuss:Then, Motley Fool analyst Nick Sciple joins Ricky to chat about TKO Group, the company's new boxing league, and why company insiders are buying up shares.To catch full episodes of all The Motley Fool's free ...",20250318T172200
This Is What Whales Are Betting On Apple - Apple  ( NASDAQ:AAPL ) ,"Financial giants have made a conspicuous bearish move on Apple. Our analysis of options history for Apple AAPL revealed 55 unusual trades. Delving into the details, we found 40% of traders were bullish, while 52% showed bearish tendencies.",20250318T150224
"Analyzing Apple In Comparison To Competitors In Technology Hardware, Storage & Peripherals Industry - Apple  ( NASDAQ:AAPL ) ","Amidst today's fast-paced and highly competitive business environment, it is crucial for investors and industry enthusiasts to conduct comprehensive company evaluations.",20250318T150050
"Trading SPY Ahead Of Fed Interest Rate Decision Tomorrow - Meta Platforms  ( NASDAQ:META ) , SPDR S&P 500  ( ARCA:SPY ) ","Good Morning Traders! In today's Market Clubhouse Morning Memo, we will discuss SPY, QQQ, AAPL, MSFT, NVDA, GOOGL, META, and TSLA. Our proprietary formula, exclusive to Market Clubhouse, dictates these price levels. This dynamic equation takes into account price, volume, and options flow.",20250318T131553
"Apple Partner Globalstar Just Set a New Record, but Did You Even Notice?","On Feb. 27, satellite communications company Globalstar ( NASDAQ: GSAT ) reported the end of its best revenue year ever. If you didn't notice, though, don't feel bad. It actually looks like almost no investors noticed.Two weeks after announcing its results, Globalstar's stock is...down about 2% ...",20250318T113000
S&P 500 Correction: 1 Incredible AI Stock That I'm Buying Now and Holding Forever,"With the S&P 500 ( SNPINDEX: ^GSPC ) closing 10% below its all-time high, it's now in correction territory. While nobody likes seeing their holdings decline by 10% or more, corrections occur about every year, so nobody should be surprised when they happen.",20250318T110000
Is iShares Paris-Aligned Climate MSCI USA ETF  ( PABU )  a Strong ETF Right Now?,Smart Beta ETF report for ...,20250318T102007
Should SPDR Portfolio S&P 500 Growth ETF  ( SPYG )  Be on Your Investing Radar?,Style Box ETF report for ...,20250318T102006
"The Best Warren Buffett Stocks to Buy With $2,000 Right Now","While stocks as a whole are selling off, there's a reason the Oracle of Omaha is sticking with these beaten-down holdings.",20250318T094500
"AI Bubble Bursting? Magnificent 7's Profit Margins Face Pressure As 'Capital Spending Can Tumble' In 2025 - Apple  ( NASDAQ:AAPL ) , Amazon.com  ( NASDAQ:AMZN ) ","As the Magnificent 7 companies have estimated a total capital expenditure of over $330 billion on the artificial intelligence infrastructure in 2025, there is a possibility that China's AI breakthrough, despite chip shortage, could affect their targets, affecting profitability.",20250318T091352
"Apple Stock Faces Pressure From Declining iPhone Revenue: Could Company's First Foldable Smartphone In 2026 Reverse Course? - Alphabet  ( NASDAQ:GOOG ) , Apple  ( NASDAQ:AAPL ) ","A foldable iPhone could be coming as early as 2026 according to several reports. Apple has been working on foldable devices for years, says reports. Join Nic Chahine live on Wednesday, March 19, at 6 PM ET for a step-by-step breakdown of how to to capitalize on post-Fed volatility and manage ...",20250317T214835
"Legendary Trader Says Tesla, Nvidia, Apple Shares Are Ready To Rally: 'I See What I Like To See' - Tesla  ( NASDAQ:TSLA ) ","Renowned trader and chartist Larry Williams believes the market is ready to rally. Williams says Tesla, Nvidia, ASML Holding and Apple shares are flashing bullish signs.",20250317T164730
"Nvidia GTC And Quantum Computing Drivers Of The Stock Market, Trump Put Fails But May Not Be Dead","To gain an edge, this is what you need to know today. Please click here for an enlarged chart of NVIDIA Corp ( NVDA ) . On the positive side, expectations are for Nvidia's data center revenue to reach $237B by January 2027. That is more than double current revenue.",20250317T150706
"Analyzing Apple In Comparison To Competitors In Technology Hardware, Storage & Peripherals Industry - Apple  ( NASDAQ:AAPL ) ","In today's rapidly changing and fiercely competitive business landscape, it is vital for investors and industry enthusiasts to carefully evaluate companies. In this article, we will perform a comprehensive industry comparison, evaluating Apple AAPL against its key competitors in the Technology ...",20250317T150049
