title,summary,time_published
Apple Supplier Foxconn Unveils AI Model Using Nvidia Tech - Foxconn Tech Co  ( OTC:FXCOF ) ,"Foxconn unveils FoxBrain AI model with reasoning, math, and coding skills, built in just four weeks using Nvidia H100 chips Foxconn pivots to AI with new FoxBrain model, aims to boost manufacturing, supply chains, and collaborate via open-source release",20250310T173533
"Money Flowing Out Of US Stock Market Into Europe, ""A Period Of Transition"" - Says Trump","To gain an edge, this is what you need to know today. Please click here for a chart comparing SPDR S&P 500 ETF Trust ( SPY ) which represents the benchmark stock market index S&P 500 ( SPX ) , Select STOXX Europe Aerospace & Defense ETF ( EUAD ) , and SPDR Euro Stoxx 50 ETF ( FEZ ) .",20250310T155305
"Alphabet's Legal Headache Isn't Going Away - And Apple Could Be The Wild Card, Says Analyst - Alphabet  ( NASDAQ:GOOGL ) ",DOJ's revised remedies tighten Google's search dominance with Apple potentially exploring new search engine options. Google avoids AI divestiture but faces tougher restrictions with a legal showdown set for August.,20250310T140551
"Stock Market News for Mar 10, 2025","Wall Street closed higher on Friday, pulled up by tech and energy stocks.",20250310T133800
Should Invesco QQQ  ( QQQ )  Be on Your Investing Radar?,Style Box ETF report for ...,20250310T102006
"Eddy Cue Praises 'Severance' For Breaking Through The Noise Globally, Says Apple TV+ Isn't Going To Throw 20 Shows On The Wall Hoping One Will Stick - Netflix  ( NASDAQ:NFLX ) ","On Sunday, Apple Inc.'s AAPL services chief Eddy Cue shared insights into Apple TV+'s selective content strategy while praising the global success of ""Severance,"" calling it one of the most culturally impactful shows of recent years.",20250310T055325
Apple Breaks Tradition With A Flood Of New Releases; Explores Smart Glasses - Apple  ( NASDAQ:AAPL ) ,"Apple breaks tradition with a surprise flurry of new product launches, including the iPhone 16e and a new iPad lineup. Amidst a slump in iPhone sales, Apple's aggressive release strategy seeks to jump-start its Q2 financial performance.",20250309T203040
"Elon Musk's xAI Expands, Apple Delays Siri, Meta's AI Assistant May Get Paid Subscriptions, And More: This Week In AI - Meta Platforms  ( NASDAQ:META ) , Apple  ( NASDAQ:AAPL ) ","The past week was a whirlwind of activity in the tech world, with artificial intelligence ( AI ) taking center stage. From Elon Musk's xAI expanding its supercomputer footprint to Apple Inc. AAPL delaying its next-gen Siri, the AI landscape continues to evolve. Here's a roundup of the top stories.",20250309T130043
"Apple's Tumultuous Week - From Siri Delays, Legal Battles, And New Product Teasers: This Week In Appleverse - Apple  ( NASDAQ:AAPL ) ","The past week has been a rollercoaster for Apple Inc. AAPL. From delays in AI upgrades to legal challenges and product teasers, the tech giant has been making headlines left, right, and center. Here's a quick recap of the top stories that shaped Apple's week.",20250309T110046
Meet the Unstoppable Artificial Intelligence  ( AI )  Stock That Could Join the $3 Trillion Club by 2028,"Artificial intelligence is already improving this business' financial results, but there could be a lot more to come.",20250309T105000
3 ETFs to Buy Now for Passive Dividend Income,"With volatility spiking and stock market indexes like the S&P 500 ( SNPINDEX: ^GSPC ) and Nasdaq Composite ( NASDAQINDEX: ^IXIC ) down on the year, investors may be looking for ways to diversify their portfolios and collect some passive income.Exchange-traded funds ( ETFs ) are one way to invest ...",20250309T101500
2 Reasons the Tech Sell-Off Could Be a Great Buying Opportunity for AI Stock Investors,"Less than three months after the Nasdaq Composite ( NASDAQINDEX: ^IXIC ) set an all-time high, the tech-heavy index is on the verge of entering a correction, which is typically defined is a pullback of 10% or more from a recent peak.In fact, on an intraday basis, the index was down more than 10% ...",20250309T080700
"Consumer Tech News  ( Mar 3-Mar 7 ) : Discord May Initiate IPO, Apple's New MacBook Air With M4 Chip, Tencent' Yuanbao AI Surpassed DeepSeek As Most Downloaded & More - Alphabet  ( NASDAQ:GOOG ) , Apple  ( NASDAQ:AAPL ) ","Trump slams UK for demanding Apple create an encryption backdoor, comparing it to China's surveillance. Tim Cook teases a new ""Air"" product, sparking speculation on a MacBook Air refresh or a new device. Every week, our Whisper Index uncovers five overlooked stocks with big breakout potential.",20250308T190042
25% of Warren Buffett-Led Berkshire Hathaway's $288 Billion Portfolio Is Invested in Only 1 Stock,"Warren Buffett is responsible for putting up tremendous returns as CEO of Berkshire Hathaway. But maybe his most lucrative bet came in the past decade, when the conglomerate purchased shares in a business that has put up a monster 900% total return since the start of 2016 ( as of March 4 ) .Even ...",20250308T143000
Could Apple Be a Millionaire-Maker Stock?,"During its rise to become a dominant tech enterprise, Apple ( NASDAQ: AAPL ) has certainly made its early investors some serious money. In the past two decades, shares have generated a total return of greater than 18,000%, boosted by the introduction of popular hardware devices and services.If ...",20250308T110000
3 Reasons Tech Investors Shouldn't Worry Too Much About Tumbling Artificial Intelligence  ( AI )  Stocks This Week,Technology investors had gotten used to a good thing -- positive momentum that seemed unstoppable. Giants in the industry led the Nasdaq to two years of double-digit gains -- and the individual stocks themselves offered shareholders mind-boggling returns.,20250308T095000
"Google's Monopoly Fight Just Got More Intense: Justice Department Reaffirms Plan To Split Up The Tech Giant In Historic Antitrust Battle - Apple  ( NASDAQ:AAPL ) , Amazon.com  ( NASDAQ:AMZN ) ","The Justice Department has doubled down on its demand to break up Alphabet Inc.'s GOOG GOOGL Google, pushing for the sale of Chrome and restrictions on its search business.",20250308T035923
"Apple Delays Next-Gen Siri: 'It's Going To Take Us Longer Than We Thought' To Deliver AI Upgrades - Apple  ( NASDAQ:AAPL ) , Amazon.com  ( NASDAQ:AMZN ) ","Apple Inc. AAPL has confirmed that its highly anticipated Siri upgrade, including AI-powered personalization and contextual awareness, has been delayed and will roll out later than expected. What Happened: On Friday, an Apple spokesperson Jacqueline Roy confirmed the delay in a statement to ...",20250308T023304
Apple  ( AAPL )  Beats Stock Market Upswing: What Investors Need to Know,"In the most recent trading session, Apple (AAPL) closed at $239.07, indicating a +1.59% shift from the previous trading day.",20250307T214519
"Stock Market Dodges Jobs Report Bullet, Crypto Reserve Details Disappoint, Germany May Go Nuclear","To gain an edge, this is what you need to know today. Please click here for an enlarged chart of SPDR S&P 500 ETF Trust ( SPY ) which represents the benchmark stock market index S&P 500 ( SPX ) . The 200 day moving average is very powerful, and all investors should pay attention to it.",20250307T173002
"Exploring The Competitive Space: Apple Versus Industry Peers In Technology Hardware, Storage & Peripherals - Apple  ( NASDAQ:AAPL ) ","In the ever-changing and fiercely competitive business landscape, conducting thorough company analysis is crucial for investors and industry experts. In this article, we will undertake a comprehensive industry comparison, evaluating Apple AAPL and its primary competitors in the Technology ...",20250307T150051
4 Reasons to Buy the Dip in Nasdaq ETFs,Nasdaq has entered into a correction territory. Time to buy the dip?,20250307T132800
"Taiwan Mulls Travel Advisory For China-Aligned Nations Amid Political Crackdown - Apple  ( NASDAQ:AAPL ) , Advanced Micro Devices  ( NASDAQ:AMD ) ","In the face of Beijing's crackdown on Taiwan independence supporters, Taiwan is reportedly contemplating issuing travel advisories for its citizens visiting countries closely aligned with China, including Laos and Cambodia.",20250307T132545
38% of Berkshire Hathaway's Portfolio Is Invested in These 3 Unstoppable Dividend Stocks,"There are several things Warren Buffett is known for as an investor. First, the Oracle of Omaha has consistently emphasized the importance of having a long-term mindset when investing in stocks. Second, he famously loves dividends.It's therefore no surprise that the company he chairs, Berkshire ...",20250307T114500
Should Vanguard Mega Cap ETF  ( MGC )  Be on Your Investing Radar?,Style Box ETF report for ...,20250307T112005
Should WisdomTree U.S. Total Dividend ETF  ( DTD )  Be on Your Investing Radar?,Style Box ETF report for DTD ...,20250307T112004
3 Allspring Mutual Funds to Buy for Impressive Returns,"Consider investing in Allspring mutual funds like EVSRX, EKBCX and WFPRX for diversified investment opportunities.",20250307T101500
"Will Your Next Smartphone Be 3-D Printed? Analyst Suggests This Pro Model Phone Could Spur That Change - Samsung Electronics Co  ( OTC:SSNLF ) , Apple  ( NASDAQ:AAPL ) ","Xiaomi Corp.'s XIACY XIACF upcoming 16 Pro flagship smartphone could feature a 3D-printed metal mid-frame - a move that could spark a broader industry shift, much like Apple Inc.'s AAPL adoption of CNC machining for MacBook unibody casings did.",20250307T033914
"Elizabeth Warren Wants To Know From Elon Musk, Mark Zuckerberg And Jeff Bezos How Much They Spent Lobbying For 'Potential Windfall' - Accuses Tech Giants Of 'Cozying Up' Up To Trump Administration - Apple  ( NASDAQ:AAPL ) , Amazon.com  ( NASDAQ:AMZN ) ","On Thursday, Sen. Elizabeth Warren ( D-Mass. ) called out five tech giants, alleging they could gain $75 billion in tax benefits due to their close ties with the Trump administration. What Happened: In a post on X, Warren pointed out that Tesla Inc. TSLA, Amazon.com Inc. AMZN, Meta Platforms ...",20250307T002837
"Law Of Unintended Consequences Hitting Stock Market, French Nuclear Weapons To Defend Europe - Spinnaker ETF Series Select STOXX Europe Aerospace & Defense ETF  ( BATS:EUAD ) ","To gain an edge, this is what you need to know today. Please click here for a chart of German bunds ( BUND ) . Bunds are German government bonds. It is important for investors to set their politics aside, go to neutral to examine events without bias.",20250306T154157
"Comparing Apple With Industry Competitors In Technology Hardware, Storage & Peripherals Industry - Apple  ( NASDAQ:AAPL ) ","In the dynamic and fiercely competitive business environment, conducting a thorough analysis of companies is crucial for investors and industry enthusiasts. In this article, we will perform an extensive industry comparison, evaluating Apple AAPL in relation to its major competitors in the ...",20250306T150053
"Apple's Foldable AI iPhone Could Cost Over $2,000, 20 Million Units Shipped By 2027: Analyst - Alibaba Gr Hldgs  ( NYSE:BABA ) , Apple  ( NASDAQ:AAPL ) ","Apple's first foldable iPhone could retail above $2,000, expected to launch in late 2026 with AI-driven features. Analyst predicts foldable iPhone shipments of 3-5M units in 2026, with total shipments reaching 20M units by 2027 as demand grows.",20250306T140841
Why Now is the Best Time to Invest in Netflix & Sony Stocks,"Netflix & Sony thrive in the subscription boom, fueled by streaming & gaming growth, with strong ties to Apple's ecosystem.",20250306T134300
"Elon Musk Pushes For Privatization Of Postal Service And Amtrak: 'It Will Leave You With A Very Bad Impression Of America' - Apple  ( NASDAQ:AAPL ) , Amazon.com  ( NASDAQ:AMZN ) ","Elon Musk, CEO of Tesla and SpaceX, as well as an advisor to President Donald Trump, has put forth a proposal for the privatization of the U.S. Postal Service and Amtrak.",20250306T132351
Should iShares Russell Top 200 Growth ETF  ( IWY )  Be on Your Investing Radar?,Style Box ETF report for ...,20250306T112006
"Apple Co-Founder Steve Wozniak Blasts DOGE's Mass Firings, Says Musk-Led Cuts Are Like Using A Sledgehammer Instead Of A Scalpel","On Wednesday, Apple Inc. co-founder Steve Wozniak criticized the Department of Government Efficiency's or DOGE approach to mass layoffs, calling its sweeping federal workforce cuts a reckless strategy that lacks precision.",20250306T081306
Apple's Latest MacBook Air With M4 Chip Is Twice As Fast As Its Predecessor With Lower Price - Apple  ( NASDAQ:AAPL ) ,M4 chip boosts MacBook Air's performance by up to 2x. MacBook Air now supports two 6K external displays. Our government trade tracker caught Pelosi's 169% AI winner. Discover how to track all 535 Congress member stock trades today.,20250305T152251
"Assessing Apple's Performance Against Competitors In Technology Hardware, Storage & Peripherals Industry - Apple  ( NASDAQ:AAPL ) ","In the ever-changing and fiercely competitive business landscape, conducting thorough company analysis is crucial for investors and industry experts. In this article, we will undertake a comprehensive industry comparison, evaluating Apple AAPL and its primary competitors in the Technology ...",20250305T150057
"Want to Invest Like Buffett? This Is What He Just Said He Looks For in ""Really Outstanding Businesses,"" and It May Not Be What You Think","Warren Buffett has earned his reputation as one of the greatest investors ever. He has led his holding company, Berkshire Hathaway, to incredible market-beating returns. As of the end of last year, Berkshire Hathaway's market value per share has increased 5,502,284% since Buffett took over, while ...",20250305T144500
"Earphones and Headphones Market to Reach USD 218278.0 Million by 2032, Growing at a 13.20% CAGR - Credence Research","PUNE, India, March 5, 2025 /PRNewswire/ -- The global Earphones and Headphones market was valued at USD 71,514.2 million in 2023 and is projected to grow significantly over the next decade.",20250305T141100
ZAGG Launches Tough Keys USB-C Direct Connect Keyboard/Case Combo for iPad  ( A16 )  and iPad  ( 10th Generation ) ,"SALT LAKE CITY , March 05, 2025 ( GLOBE NEWSWIRE ) -- ZAGG, a global leader in premium mobile accessories and technologies, is proud to announce the launch of the Tough Keys USB-C Direct Connect keyboard/case combo, the ultimate companion for the new Apple iPad ( A16 ) and the existing Apple ...",20250305T130000
This Once-Unstoppable Low-Cost Vanguard ETF Is Underperforming the S&P 500 in 2025. Here's Why It's a Buy Now.,"Technology stocks like Nvidia ( NASDAQ: NVDA ) , Apple ( NASDAQ: AAPL ) , and Microsoft ( NASDAQ: MSFT ) have increased by severalfold over the last decade -- helping drive the S&P 500 ( SNPINDEX: ^GSPC ) to new heights. But year to date, tech has been one of the worst-performing stock market ...",20250305T112400
Is Franklin U.S. Equity Index ETF  ( USPX )  a Strong ETF Right Now?,Smart Beta ETF report for ...,20250305T112008
Should SPDR S&P 500 ETF  ( SPY )  Be on Your Investing Radar?,Style Box ETF report for SPY ...,20250305T112007
Should iShares Core S&P 500 ETF  ( IVV )  Be on Your Investing Radar?,Style Box ETF report for ...,20250305T112006
Should Fidelity Quality Factor ETF  ( FQAL )  Be on Your Investing Radar?,Style Box ETF report for ...,20250305T112005
"Chinese Smartphone Brands Tap Google AI to Compete with Global Tech Giants - Alphabet  ( NASDAQ:GOOG ) , Apple  ( NASDAQ:AAPL ) ",Chinese smartphone manufacturers are joining forces with Google's GOOG GOOGL artificial intelligence ( AI ) to take on international tech behemoths such as Apple Inc. AAPL and Samsung Electronics Co. SSNLF.,20250305T090827
"Google Fights Back Against DOJ Antitrust Cases, Says Breakup Threatens Economy, National Security: Report - Alphabet  ( NASDAQ:GOOG ) , Apple  ( NASDAQ:AAPL ) ","Alphabet Inc.'s GOOGL GOOG Google is urging the U.S. government to reconsider its antitrust cases, warning that potential breakup proposals could harm the American economy and national security. What Happened: The U.S.",20250305T071916
"Trump's Says 'Little Disturbance' Possible Due To Tariffs In Speech To Congress As GM, Tesla, Energy Stocks Lift In After-Hours Trading: 'Auto Industry To Absolutely Boom' - Apple  ( NASDAQ:AAPL ) , BP  ( NYSE:BP ) ","President Donald Trump's congressional address triggered significant after-hours market movements across a wide range of stocks. Taiwan Semiconductor Mfg. Co. TSM rose 0.77% to $181.38, while Apple Inc. AAPL increased 0.72% to $237.63. Oracle Corp.",20250305T051857
"Trump's Congressional Address: Taps Elon Musk For Government Overhaul, Revives 'Drill Baby Drill' For Energy Boom - Apple  ( NASDAQ:AAPL ) , Oracle  ( NYSE:ORCL ) ","President Donald Trump delivered a wide-ranging congressional address that touched on critical economic issues, with particular emphasis on electric vehicles, energy production, and government efficiency.",20250305T032619
Apple Challenges UK's 'Backdoor' Order In Landmark Legal Case After Trump Compares Directive To China-Style Surveillance: Report - Apple  ( NASDAQ:AAPL ) ,"Apple Inc. AAPL has reportedly launched a legal battle against the U.K. government, challenging a directive that would force the company to create a ""backdoor"" into its encrypted iCloud storage, a move that has drawn criticism from President Donald Trump.",20250305T032557
Taiwan Semiconductor Rises As $100 Billion U.S. Expansion Defies Market Downturn - Taiwan Semiconductor  ( NYSE:TSM ) ,"Taiwan Semiconductor is investing an additional $100 billion in U.S. chip manufacturing, bringing its total U.S. commitment to $165 billion. The investment includes new fabrication plants and R&D facilities, aiming to boost U.S. chip production and solidify TSM's dominance.",20250304T203942
"February's 20 Most-Searched Tickers On Pro - Where Do Tesla, Palantir, Alibaba, Nvidia Stocks Rank? - Apple  ( NASDAQ:AAPL ) , Firefly Neuroscience  ( NASDAQ:AIFF ) ","A look at the top 20 most-searched tickers on Benzinga Pro in the month of January. Several of the names are popular tickers with some lesser known, high-moving stocks making this month's list. Every week, our Whisper Index uncovers five overlooked stocks with big breakout potential.",20250304T203644
"Nvidia, Apple, and Eli Lilly: Manufacturing the Future",The great buildout for AI and GLP-1 drugs continues.,20250304T183600
"Investors Shouldn't 'Run To The Hills' Over Tariffs: Dan Ives Points To 8 AI Stocks 'To Own' - Apple  ( NASDAQ:AAPL ) , Amazon.com  ( NASDAQ:AMZN ) ","Technology stocks are falling Tuesday on fears from the tariffs on Mexico, Canada and China. Tech analyst Dan Ives sees the pullback as a buying opportunity. Our government trade tracker caught Pelosi's 169% AI winner. Discover how to track all 535 Congress member stock trades today.",20250304T165301
"How Companies Are Tweaking Products To Cut Trump's Tariff Costs - Apple  ( NASDAQ:AAPL ) , Columbia Sportswear  ( NASDAQ:COLM ) ","As President Donald Trump threatens new import duties beginning March 4, American businesses are exploring creative strategies to reduce tariff costs rather than moving production to the U.S.",20250304T164547
"Raising Cash And Hedges, Pay Attention To Stock Market Support Zone Trump's Speech","To gain an edge, this is what you need to know today. It is time to raise cash and hedges. For details, please see the section below titled ""Protection Band And What To Do Now."". There are a number of triggers for this call that include ISM data and President Trump following through with tariffs.",20250304T163334
Sirius XM Plunges 42.3% in a Year: How Should You Play the Stock?,"SIRI expands content and improves engagement, but with falling subscription revenues and strong competition, investors can wait for better entry points.",20250304T161700
Apple Partner Globalstar Teams Up With GCT Semiconductor to Power Satellite Messaging with IoT Chips - Globalstar  ( NASDAQ:GSAT ) ,"GCT Semiconductor and Globalstar partner to develop two-way satellite messaging for mobile devices and IoT modules. Globalstar to use GCT's 4G LTE and 5G IoT chips, enabling seamless switching between cellular and satellite networks worldwide.",20250304T151210
"Inquiry Into Apple's Competitor Dynamics In Technology Hardware, Storage & Peripherals Industry - Apple  ( NASDAQ:AAPL ) ","In today's rapidly changing and fiercely competitive business landscape, it is essential for investors and industry enthusiasts to thoroughly analyze companies. In this article, we will conduct a comprehensive industry comparison, evaluating Apple AAPL against its key competitors in the ...",20250304T150052
Apple's $500B U.S. Investment? Analyst Calls It 'Completely Unrealistic' - Questions Where The Money Will Come From - Apple  ( NASDAQ:AAPL ) ,"Apple's AAPL latest announcement to invest $500 billion in the U.S. over the next four years has everyone talking. The tech giant plans to hire 20,000 people, expand its manufacturing presence, and build a massive new AI-focused factory in Texas.",20250304T144520
"Introducing New Cloud-Based CorelDRAW Go, Creative and Workflow Enhancements in CorelDRAW Graphics Suite 2025, and Browser-Based Design with CorelDRAW Web","CorelDRAW Go provides a beginner-friendly design experience, empowering creativity from anywhere. CorelDRAW Graphics Suite delivers Painterly Brush tool enhancements and streamlined print to PDF workflows, alongside flexible, online design with CorelDRAW Web.",20250304T140057
"Best Buy Revenue Upbeat, Health Drags","Best Buy surpassed earnings expectations for its fourth quarter, but faced challenges in its health division.",20250304T133623
Why Visa & PayPal are Must-Buy Stocks in Apple's Cashless Revolution,Investors looking to capitalize on Apple's digital payments revolution may consider buying Visa and PayPal.,20250304T131100
"3 Dividend Stock ETFs to Buy With $2,000 and Hold Forever","There is no shortage of excellent, low-cost exchange-traded funds ( ETFs ) that specialize in dividend stocks. There are some that focus on stocks that pay above-average dividends, stocks whose dividends grow rapidly, and dividend-paying stocks that have certain characteristics in common.",20250304T130800
Trump Tariffs & Retaliatory Moves Put These ETF Areas in Focus,"A second round of tariffs imposed on Canada, China and Mexico by President Donald Trump takes effect today. These ETF areas would be impacted.",20250304T130000
Apple Stock Investors: Here's What You Need to Know,"Apple ( NASDAQ: AAPL ) boasts one of the highest customer satisfaction ratings of any company.*Stock prices used were the afternoon prices of Feb. 27, 2025. The video was published on March 1, 2025.Continue reading ...",20250304T123000
Which Will Win the Race to $5 Trillion: Apple or Nvidia Stock?,"Although the world has never seen a $5 trillion company, there is a competitive race between Apple ( NASDAQ: AAPL ) and Nvidia ( NASDAQ: NVDA ) . Apple has a large lead with its $3.6 trillion market cap, but Nvidia isn't far behind with a $3 trillion market cap.",20250304T123000
"Taiwan Semiconductor Doubles Down On US Chipmaking, Plans $165 Billion Investment - Taiwan Semiconductor  ( NYSE:TSM ) ","TSMC boosts U.S. investment to $165B, adding 3 new fabs, 2 packaging sites & an R&D center for advanced semiconductor manufacturing. Expansion to create 40K construction jobs, tens of thousands of high-tech roles & drive $200B+ in economic output over the next decade.",20250304T112009
Is FlexShares Quality Dividend ETF  ( QDF )  a Strong ETF Right Now?,Smart Beta ETF report for ...,20250304T112007
Should Vanguard S&P 500 Growth ETF  ( VOOG )  Be on Your Investing Radar?,Style Box ETF report for ...,20250304T112006
Should Fidelity Nasdaq Composite Index ETF  ( ONEQ )  Be on Your Investing Radar?,Style Box ETF report for ...,20250304T112005
"Warren Buffett Just Sold 4 Bank Stocks, but Hasn't Unloaded a Single Share of These 2","Warren Buffett has been a fan of the banking industry for many years. Out of the roughly 40 stocks in Berkshire Hathaway's ( NYSE: BRK.A ) ( NYSE: BRK.B ) closely watched portfolio, six of them are banks -- including two of the three largest positions.However, Berkshire has significantly reduced ...",20250304T104300
"2 Magnificent Warren Buffett Stocks That Make for Screaming Buys in March, and 1 to Avoid","Two historically inexpensive stocks in Berkshire Hathaway's $297.5 billion portfolio are ripe for the picking, while the Oracle of Omaha's top holding is sending all the wrong signals.",20250304T100600
Apple's $500 Billion Investment in America: Is the Stock a Buy?,"The reshoring of manufacturing to North America is becoming a huge theme throughout corporate America. Whether their management teams are acting to avoid the impact of tariffs or because it makes sense to them on broader business and geopolitical levels, numerous companies recently made major ...",20250304T090400
"Zacks Investment Ideas feature highlights Taiwan, Apple, Nvidia and AMD","Taiwan, Apple, Nvidia and AMD have been highlighted in this Investment Ideas article.",20250304T080400
Tim Cook Says 'There's Something In The Air' - New MacBook Air Or A Surprise Product Launch On The Cards? - Apple  ( NASDAQ:AAPL ) ,"On Monday, Apple Inc. AAPL CEO Tim Cook sparked speculation with a cryptic teaser hinting at a new ""Air"" product launch this week, leaving fans wondering whether it's the highly anticipated MacBook Air or something entirely unexpected.",20250304T021816
Markets Pull Back Late on New Tariff Talk,"Today's fall was steady and modest until this afternoon, when it was announced +25% tariffs are indeed being levied onto our direct neighbors Canada and Mexico.",20250303T234100
Buy Taiwan Semiconductor  ( TSM )  Stock for Expansion Plans in the U.S.?,"Taiwan Semiconductor (TSM) is making headlines on Monday, with the chip giant set to invest $100 billion for manufacturing plants in the United States.",20250303T200400
