title,summary,time_published
Apple's and Meta's Robotics Ambitions,"In this podcast, Motley Fool analyst Jason Moser and host Ricky Mulvey discuss:Then, Motley Fool host Alison Southwick and personal finance expert Robert Brokamp answer listener questions about saving for kids, how inflation affects financial ratios, and starting a 401 ( k ) plan at your ...",20250224T202300
Bull Market Intact: Why Friday's Plunge was Likely Overdone,"After stocks plunged Friday and the Nasdaq gave up its year-to-date gains, investors may wonder whether or not the US equity bull market remains intact. Stock Strategist Andrew Rocco provides some timely clues.",20250224T195300
"Palantir Extends Losses, Microsoft Slides: What's Driving Markets Monday? - SPDR S&P 500  ( ARCA:SPY ) ","Investors are closely watching Nvidia's upcoming quarterly earnings report, scheduled for release on Wednesday. Natural gas futures fall more than 6% toward $43.9/MMBtu, retreating from a 25-month high reached last week.",20250224T175427
"Taiwan Semiconductor Poised For Surge, Goldman Sachs Predicts Rising Demand For Taipei-Traded Stock: Report - Taiwan Semiconductor  ( NYSE:TSM ) ","Taiwan Semiconductor's stock has soared by over 2900%, fueled by AI developments and key partnerships with Nvidia and Apple. Changes in Taiwan's ETF regulations could increase demand for local shares, potentially lifting the current 30% cap on single-stock weight i",20250224T174520
"Rule Breaker Investing: Pet Perks, Vol. 2",Little things can make a big difference.,20250224T162100
"Understanding Apple's Position In Technology Hardware, Storage & Peripherals Industry Compared To Competitors - Apple  ( NASDAQ:AAPL ) ","In the fast-paced and highly competitive business world of today, conducting thorough company analysis is essential for investors and industry observers. In this article, we will conduct an extensive industry comparison, evaluating Apple AAPL in relation to its major competitors in the Technology ...",20250224T150050
Should You Buy Apple Stock Instead of Microsoft Stock?,"Apple ( NASDAQ: AAPL ) and Microsoft ( NASDAQ: MSFT ) are two of the most successful companies in the world, but only one can be the better long-term investment in this comparison.*Stock prices used were the afternoon prices of Feb. 20, 2025. The video was published on Feb. 22, 2025.Continue ...",20250224T143611
"Apple 'Forced To Kiss The Ring'? Expert Questions Whether Trump Pushed The iPhone Maker For $500 Billion Investment - Invesco QQQ Trust, Series 1  ( NASDAQ:QQQ ) ","As the iPhone maker Apple Inc. AAPL announced its plans to invest $500 billion in the U.S. over the next four years, this expert says that the technology giant was ""forced to kiss the ring,"" in his latest post.",20250224T143024
Apple Makes $500 Billion Bet: Is AAPL Stock Ready To Shine Or Stumble? - Apple  ( NASDAQ:AAPL ) ,"Apple's stock stays bullish, trading above key moving averages with strong MACD and RSI indicators. Rising selling pressure hints at a potential cooldown despite Apple's $500 billion U.S. investment plan. Get two weeks of free access to pro-level trading tools, including news alerts, scanners, ...",20250224T141912
"Trump Says Apple's $500 Billion Investment Is Due To His Policies: 'Without Which, They Wouldn't Be Investing Ten Cents' - Apple  ( NASDAQ:AAPL ) ","President Donald Trump took to social media to praise Apple Inc. AAPL for its record $500 billion investment in the U.S. What Happened: On Monday, Trump took to his Truth Social platform to share the news.",20250224T140021
"Apple Commits $500 Billion In US Investment For AI Push, Boost US Manufacturing Tech - Apple  ( NASDAQ:AAPL ) , Broadcom  ( NASDAQ:AVGO ) ","Apple commits over $500 billion to U.S. investments, focusing on AI, silicon engineering, and expanding advanced manufacturing. Apple plans to hire 20,000 workers, build AI servers in Houston, and expand data centers to support Apple Intelligence.",20250224T133258
Is iShares Core S&P U.S. Growth ETF  ( IUSG )  a Strong ETF Right Now?,Smart Beta ETF report for ...,20250224T112007
Should iShares S&P 100 ETF  ( OEF )  Be on Your Investing Radar?,Style Box ETF report for ...,20250224T112006
Is Goldman Sachs ActiveBeta World Low Vol Plus Equity ETF  ( GLOV )  a Strong ETF Right Now?,Smart Beta ETF report for ...,20250224T112006
Should Vanguard Mega Cap Growth ETF  ( MGK )  Be on Your Investing Radar?,Style Box ETF report for ...,20250224T112006
Buy These 3 Carillon Mutual Funds for Sustainable Returns,"Invest in Carillon mutual funds like EISIX, HAGAX and HRCIX for a diversified portfolio.",20250224T095800
"Apple's M4 MacBook Air Set For March Debut, Says Top Analyst - New 13-Inch And 15-Inch Models Reportedly Incoming - Apple  ( NASDAQ:AAPL ) ","Apple Inc. AAPL is reportedly preparing to launch new 13-inch and 15-inch MacBook Air models featuring M4 chips in March. What Happened: In his latest installment of the ""Power On"" newsletter, Bloomberg columnist Mark Gurman said that Apple has begun drawing down inventory of existing MacBook Air ...",20250224T085821
"Alibaba Commits Unprecedented $53 Billion To AI Infrastructure. Competes With Trump's Stargate AI Plan - Alibaba Gr Hldgs  ( NYSE:BABA ) , Apple  ( NASDAQ:AAPL ) ","Alibaba Group Holding Ltd. BABA has announced an investment of 380 billion yuan ( nearly $53 billion ) for its cloud computing and AI infrastructure, making it the largest private computing project to date.",20250224T083722
"Apple May Soon Integrate Google's Gemini In Siri, Shows iOS 18.4 Leak - Alibaba Gr Hldgs  ( NYSE:BABA ) , Apple  ( NASDAQ:AAPL ) ","Apple Inc. AAPL may soon integrate Alphabet Inc.'s GOOG GOOGL Google Gemini into Siri. What Happened: Apple Intelligence, introduced with iOS 18, currently allows Siri to direct requests to OpenAI's ChatGPT for more contextual responses.",20250224T050854
Apple Ditches Budget Smartphone Segment With iPhone 16E Launch - Apple  ( NASDAQ:AAPL ) ,"Apple breaks away from the budget phone race with its new iPhone 16e's premium pricing. Get access to your new suite of high-powered trading tools, including real-time stock ratings, insider trades, and government trading signals. In a strategic shift, Apple Inc.",20250223T185019
"Consumer Tech News  ( Feb 17-Feb 21 ) : Mexico Warns Alphabet Over Naming of the ""Gulf of Mexico"" On Maps, Apple Launches iPhone 16E & More - Apple  ( NASDAQ:AAPL ) , Amazon.com  ( NASDAQ:AMZN ) ","Bumble's revenue falls to $261.6M in Q4, with paying users dropping by 57K from the previous quarter. Apple plans in-house 5G modem for iPhone SE 4 but may lag behind Qualcomm's Snapdragon X75.",20250223T154517
"Bill Gates' Concerns, Nvidia' Leap In Genetic Research, Elon Musk's Grok Beats OpenAI's ChatGPT, And More: This Week In AI - Alibaba Gr Hldgs  ( NYSE:BABA ) , Apple  ( NASDAQ:AAPL ) ","The week was abuzz with news from the tech world, with artificial intelligence ( AI ) taking center stage. From Bill Gates issuing a warning to the next generation to Nvidia Corp. NVDA and Alibaba Group Holding Ltd. BABA making strides in AI, the weekend was anything but quiet.",20250223T140020
"If You Invested $10,000 in Apple Stock 30 Years Ago, Here's How Much You Would Have Today","All investors dream about finding that one stock that can catapult them into millionaire status. You can never know which stocks are going to be those rare winners, and there's certainly a bit of luck in choosing your portfolio.",20250223T132000
"Apple's iPhone 16E Launch, US Investment Pledge, Potential Price Hikes, And More: This Week In Appleveres - Apple  ( NASDAQ:AAPL ) ","It was an eventful week for tech giant Apple Inc. AAPL, with the company making headlines for a variety of reasons. From the launch of a new budget-friendly iPhone to a significant investment pledge in the United States, Apple was in the spotlight. Here's a recap of the top stories.",20250223T120042
"Apple's iPhone 16E Launch, US Investment Pledge, Potential Price Hikes, And More: This Week In Appleverse - Apple  ( NASDAQ:AAPL ) ","It was an eventful week for tech giant Apple Inc. AAPL, with the company making headlines for a variety of reasons. From the launch of a new budget-friendly iPhone to a significant investment pledge in the United States, Apple was in the spotlight. Here's a recap of the top stories.",20250223T120000
2 No-Brainer Chip Companies to Ride the Artificial Intelligence  ( AI )  Investing Wave,"When you hear about artificial intelligence ( AI ) investing, you may think of the software powered by the technology or the hardware that trains the model. However, investors should also think of the chips that go into these devices to power the AI models.The chip market is a huge investment ...",20250223T120000
"Is Apple a Buy, Sell, or Hold in 2025?","With a market capitalization of $3.7 trillion, Apple ( NASDAQ: AAPL ) is the largest company in the world. Meanwhile, most investors own the stock either directly or indirectly through exchange-traded funds ( ETFs ) or mutual funds that track major market indices.",20250223T113000
Apple Bows Out of UK's Cloud Encryption Amid Government's 'Backdoor' Demands Apple Bows Out of UK's Cloud Encryption Amid Government's 'Backdoor' Demands - Apple  ( NASDAQ:AAPL ) ,"Apple removes Advanced Data Protection from the UK after government demands secret access to encrypted user data. UK's ""backdoor"" request sparks backlash, with experts warning it undermines privacy and weakens security for British users.",20250222T203046
Billionaire Philippe Laffont Just Loaded Up on My Favorite Artificial Intelligence  ( AI )  Stock,"The latest round of 13F filings is out, which means investors can see what billionaire hedge fund managers have been doing with their money. One firm I follow is Coatue Management, run by billionaire Philippe Laffont. In the fourth quarter, his firm bought 596,000 shares of one of my favorite ...",20250222T120300
Could Buying Roku Stock Today Set You Up for Life?,"Roku ( NASDAQ: ROKU ) recently reported financial results for the three-month period that ended Dec. 31, 2024. Revenue increased 22% year over year to $1.2 billion. The business posted a net loss per share of $0.24, a notable improvement from Q4 2023. These headline figures came in ahead of Wall ...",20250222T095500
"Top Analyst Wars Of Looming Stock Market Correction As S&P 500 Records Biggest Single Day Loss Since Dec. 18: 'We Could See It Trigger A Larger Sell Off' - NVIDIA  ( NASDAQ:NVDA ) , Apple  ( NASDAQ:AAPL ) ","Goldman Sachs expert Scott Rubner has cautioned that Wall Street stocks may face a downturn, citing growing instability in the options market as a key factor behind his prediction.",20250222T062214
"Trump Moves To Impose Tariffs On Countries With Digital Taxes, Defending Apple, Amazon, Meta, Google And Other US Tech Giants - Apple  ( NASDAQ:AAPL ) , Amazon.com  ( NASDAQ:AMZN ) ","President Donald Trump ordered his trade chief to reopen investigations into digital service taxes imposed on U.S. tech firms, a move that could result in new tariffs on affected countries.",20250222T032508
Tim Cook Reportedly Tells Trump Apple Will Invest 'Hundreds Of Billions' In US: 'They Don't Want To Be In The Tariffs' - Apple  ( NASDAQ:AAPL ) ,Apple Inc. AAPL CEO Tim Cook has reportedly pledged a significant investment in the United States and a shift in manufacturing from Mexico to the U.S. President Donald Trump made this announcement during a meeting with governors.,20250222T015255
"Warren Buffett's Annual Shareholder Letter Arrives Saturday: Could Investors Get Updates On Apple, Succession, New Investments? - Apple  ( NASDAQ:AAPL ) , Domino's Pizza  ( NASDAQ:DPZ ) ","Warren Buffett writes an annual shareholder letter covering Berkshire Hathaway's investments and his current thoughts. The 2024 shareholder letter will be released on the Berkshire Hathaway website on Saturday, Feb. 22, 2025.",20250221T200856
China Stocks: Why the Party is Just Starting,"In today's commentary, Stock Strategist Andrew Rocco explains how an expanding balance sheet, record share buybacks, and historically high short interest suggest that the Chinese stock market is just getting started.",20250221T181100
"Apple Expands Apple TV+ to Android, Eyes Subscription Growth and Ecosystem Expansion, Analyst Says - Alphabet  ( NASDAQ:GOOG ) , Apple  ( NASDAQ:AAPL ) ","Apple expands Apple TV app to Android users, aiming to boost subscription revenue and brand awareness. BofA analyst sees Apple TV+ on Android driving $2 billion in revenue and enhancing long-term iOS migrations.",20250221T161106
Alibaba Jumps Post Q3 Earnings: ETFs to Buy,"Alibaba records its fastest pace of revenue growth in more than a year, spreading cheer among investors.",20250221T160000
"China's Oppo Heats Up Smartphone Landscape, Launches AI-Powered Foldable At Competitive Price - Alibaba Gr Hldgs  ( NYSE:BABA ) , Apple  ( NASDAQ:AAPL ) ","Oppo unveils AI-powered foldable Find N5, challenging Apple and Samsung with advanced camera and AI assistant features Apple fights to regain market share as Oppo, Huawei, and Samsung push AI-driven smartphones at competitive prices",20250221T150433
"In-Depth Analysis: Apple Versus Competitors In Technology Hardware, Storage & Peripherals Industry - Apple  ( NASDAQ:AAPL ) ","In today's rapidly changing and fiercely competitive business landscape, it is vital for investors and industry enthusiasts to carefully evaluate companies. In this article, we will perform a comprehensive industry comparison, evaluating Apple AAPL against its key competitors in the Technology ...",20250221T150056
"If I Could Only Buy 1 Warren Buffett Artificial Intelligence  ( AI )  Stock, This Would Be It  ( Hint: It's Not Apple ) ","Apple is Berkshire Hathaway's largest position, but I see a different artificial intelligence (AI) stock as the better opportunity.",20250221T144700
SPY: How High or Low Could It Potentially Go Today? - Microsoft  ( NASDAQ:MSFT ) ,"Good Morning Traders! In today's Market Clubhouse Morning Memo, we will discuss SPY, QQQ, AAPL, MSFT, NVDA, GOOGL, META, and TSLA. Our proprietary formula, exclusive to Market Clubhouse, dictates these price levels. This dynamic equation takes into account price, volume, and options flow.",20250221T141018
"Meta and Google Execs Criticize Europe's Strict AI Rules. 'Sometimes It Goes Too Far', Says Meta Exec - Alphabet  ( NASDAQ:GOOG ) , Apple  ( NASDAQ:AAPL ) ","Mark Zuckerberg's Meta Platforms META and Google GOOGL GOOG have voiced their concerns over Europe's stringent artificial intelligence ( AI ) regulations, arguing that these rules are hampering the growth of the region's tech industry.",20250221T133808
"This Tech Giant Is Making Big Moves With Generative AI, but Here Are 3 Risks Investors Need to Know About",What's holding back the AI revolution? Even the largest tech companies are struggling with three distinct challenges in the race to artificial intelligence leadership.,20250221T133000
"Taiwan Semiconductor Too Big For The Index, Regulator Considers Lifting Weight Cap - Taiwan Semiconductor  ( NYSE:TSM ) ","Taiwan may lift ETF stock cap as TSMC's market weight surges past 37%, complicating index tracking. TSMC ramps up US expansion amid Taiwan's push for stronger AI chip alliances and trade ties.",20250221T132007
Is Xtrackers Net Zero Pathway Paris Aligned US Equity ETF  ( USNZ )  a Strong ETF Right Now?,Smart Beta ETF report for ...,20250221T112008
"BlackRock's Bitcoin ETF Or Invesco QQQ, Which $1,000 Investment Made A Year Ago Would Have Netted You More Profit? - Apple  ( NASDAQ:AAPL ) ","The Invesco QQQ Trust QQQ is one of the most popular exchange-traded funds in the world, giving customers exposure to the tech-heavy Nasdaq-100 index. It has over $341 billion in assets under management as of this writing",20250221T110030
Why Did Warren Buffett Just Sell Investments He's Recommended Millions of Others Buy?,"Warren Buffett wrote to Berkshire Hathaway shareholders in 2014 that most investors shouldn't try to pick individual stocks to buy because they couldn't ""predict their future earnings power."" Instead, he recommended that the typical investor buy a ""low-cost S&P 500 index fund."" Berkshire's ...",20250221T105200
Apple's Visual Intelligence May Come To iPhone 15 Pro: Here's How It Can Transform Your Camera With AI-Powered Real-Time Search - Apple  ( NASDAQ:AAPL ) ,Apple Inc.'s AAPL AI-driven Visual Intelligence feature is reportedly coming to iPhone 15 Pro models in an upcoming iOS update.,20250221T102333
60% of Warren Buffett's $299 Billion Portfolio at Berkshire Hathaway Is Invested in These 4 Magnificent Stocks,The Oracle of Omaha has $180 billion collectively invested in four brand-name companies with well-defined competitive advantages and phenomenal capital-return programs.,20250221T095100
"Apple CEO Tim Cook Meets Trump Amid Trade War Tensions, Privacy Concerns - Apple  ( NASDAQ:AAPL ) ","Amid escalating trade tensions between the U.S. and China, Apple Inc.'s AAPL CEO Tim Cook is said to have met President Donald Trump. What Happened: Citing an anonymous source, Bloomberg reported a possible meeting between Cook and Trump at the White House. The purpose of the meeting, however, ...",20250221T094024
1 Supercharged Growth ETF I'm Buying Hand Over Fist Right Now,"Investing in the stock market is a powerful way to build wealth, and exchange-traded funds ( ETFs ) make the process simpler and more approachable.A growth ETF is a collection of stocks with the potential to earn higher-than-average returns, with all of these stocks bundled together into a ...",20250221T083000
Prediction: 1 Artificial Intelligence  ( AI )  Stock That Will Be Worth More Than Nvidia 5 Years From Now,Demand for chips that power artificial intelligence (AI) could eventually slow.,20250221T080200
"Leaker Claims Apple's Next-Gen C2 Modem Is Already In Testing- Here's What It Means For iPhone 5G Connectivity - Apple  ( NASDAQ:AAPL ) , Broadcom  ( NASDAQ:AVGO ) ","Apple Inc. AAPL is reportedly testing its second-generation C2 modem for upcoming iPhone models. What Happened: A private X, formerly Twitter, account with a track record of accurate Apple leaks claims that the company is already testing the C2 modem, internally identified as ""C4020,"" reported ...",20250221T064938
"Apple Stock Has Run Up Over 10% In A Month, Jim Cramer Says iPhone Maker Is 'Ramping' And The Credit Goes To Chinese Subsidies - Apple  ( NASDAQ:AAPL ) ","Apple Inc. AAPL shares have gained over 10% in the past month, with CNBC's Jim Cramer attributing recent momentum to Chinese government subsidies covering Apple products. What Happened: ""Apple phone qualifies for China subsidies.. big reason why ramping last few days,"" Cramer wrote on X on Thursday.",20250221T034948
Unity Software: Earnings Beat Sparks Breakout,"Unity Software's recent earnings beat, breakaway gap, and leadership certainty signal a bright future for the stock over the next 6-12 months.",20250220T194700
Can the Latest iPhone 16e Push the Apple Stock Higher in 2025?,"Although AAPL's AI push and growing Services business are positives, stretched valuation and China headwinds are concerning in 2025.",20250220T163200
"Apple Stock Set For Streaming Lift? 'Severance' Breaks Record After X Ads, Tim Cook Promo - Apple  ( NASDAQ:AAPL ) ","AppleTV+ has a streaming hit with ""Severance."" The recent second season saw high viewership and strong sign-ups for the streaming platform. Get access to your new suite of high-powered trading tools, including real-time stock ratings, insider trades, and government trading signals.",20250220T161828
"LKQ Q4 Earnings Surpass Expectations, Revenues Decline Y/Y",LKQ reports mixed fourth-quarter results and expects 2025 parts and services organic revenue growth in the range of 0-2% year over year.,20250220T155300
"How To Trade SPY, QQQ, AAPL, MSFT, NVDA, GOOGL, META, TSLA Today","Good Morning Traders! In today's Market Clubhouse Morning Memo, we will discuss SPY, QQQ, AAPL, MSFT, NVDA, GOOGL, META, and TSLA. Our proprietary formula, exclusive to Market Clubhouse, dictates these price levels. This dynamic equation takes into account price, volume, and options flow.",20250220T142436
"Stock Market News for Feb 20, 2025","U.S. stock ended higher on Wednesday, with the S&P 500 closing at a fresh record high, as investors assessed the minutes from the Federal Reserve's January policy meeting and weighed President Donald Trump's tariff threats.",20250220T141800
"Alibaba Q3 Earnings: Revenue And EPS Beat, Eyes Global E-Commerce Profitability In FY25, Increase Investments In AI - Alibaba Gr Hldgs  ( NYSE:BABA ) ",Alibaba beats Q3 estimates with 8% revenue growth as cloud and international commerce drive strong gains. Alibaba's cash reserves hit $83.6B as AI-driven cloud growth and global expansion fuel momentum.,20250220T131846
Is Invesco FTSE RAFI US 1000 ETF  ( PRF )  a Strong ETF Right Now?,Smart Beta ETF report for PRF ...,20250220T112007
Is iShares MSCI USA Quality GARP ETF  ( GARP )  a Strong ETF Right Now?,Smart Beta ETF report for ...,20250220T112006
"The Ultimate Warren Buffett Stock to Buy With $1,000 Right Now",Berkshire Hathaway is still the Oracle of Omaha's best long-term investment.,20250220T112000
Bitcoin-Friendly Bank Stock Held By Warren Buffett And Cathie Wood Has Crushed Their Top Holdings Apple And Tesla In 2025 - Grayscale Bitcoin Mini Trust  ( BTC )  Common units of fractional undivided beneficial interest  ( ARCA:BTC ) ,"Berkshire Hathaway Chairman Warren Buffett and Ark Invest CEO Cathie Wood are two of the most sought-after investors in the capital markets, with significant media attention centered on their stock picks.",20250220T111019
"This Simple Dividend ETF Could Turn $1,000 a Month Into More Than $232,000",The JPMorgan Nasdaq Equity Premium Income ETF ( NASDAQ: JEPQ ) is one of the market's most interesting monthly income-paying exchange-traded funds ( ETFs ) . Its management aims to generate relatively low-volatility returns and a consistent monthly income for investors through a simple strategy ...,20250220T104500
"Elon Musk's Grok Overtakes OpenAI's ChatGPT, Google Gemini, And China's DeepSeek As The Leading Productivity App On Apple's App Store - Alphabet  ( NASDAQ:GOOG ) , Apple  ( NASDAQ:AAPL ) ","Elon Musk's AI startup, xAI's Grok, has surpassed OpenAI's ChatGPT, Alphabet Inc. GOOG GOOGL subsidiary Google's Gemini, and China's DeepSeek to become the leading productivity app on Apple Inc.'s AAPL App Store. What Happened: On Thursday, Musk shared a screenshot highlighting the achievement of ...",20250220T101225
"NVIDIA's New AI System Aims To Transform Genetic Research With Unmatched Speed And Precision - Apple  ( NASDAQ:AAPL ) , Amazon.com  ( NASDAQ:AMZN ) ","NVIDIA NVDA has introduced Evo 2, an advanced artificial intelligence ( AI ) system aimed at transforming the field of biological research.",20250220T095655
Warren Buffett Just Pressed the Sell Button on the Stock Market. But There Is a Silver Lining,"Each quarter, investors wait for Warren Buffett's company Berkshire Hathaway ( NYSE: BRK.A ) ( NYSE: BRK.B ) to file its 13-F form with the Securities and Exchange Commission, disclosing what stocks the company owned at the end of each quarter.",20250220T095500
Marjorie Taylor Greene Just Bought These 5 Artificial Intelligence  ( AI )  Stocks. Should You?,"Some closely follow the stocks bought and sold by famous investors such as Warren Buffett. Copying Buffett's investments through the years would have enabled you to make a lot of money.Another strategy that has become increasingly popular recently, though, is to follow the stocks bought and sold ...",20250220T095000
"Trump's Goal Is To 'Abolish' IRS And 'Let All The Outsiders Pay,' Says Newly Confirmed Commerce Secretary Howard Lutnick - Apple  ( NASDAQ:AAPL ) , Boeing  ( NYSE:BA ) ","Howard Lutnick, the newly confirmed Commerce Secretary under President Donald Trump's administration, reiterated the President's proposal for the abolition of the Internal Revenue Service ( IRS ) .",20250220T085609
"Apple's Newly Launched iPhone 16e Will Boost The iPhone Revenue For FY25, Predicts Deepwater's Gene Munster - Alibaba Gr Hldgs  ( NYSE:BABA ) , Apple  ( NASDAQ:AAPL ) ","Deepwater Management's Gene Munster anticipates a revenue boost for Apple Inc. AAPL in FY25, driven by the newly launched iPhone 16e. What Happened: On Wednesday, Munster posted his insights on Apple's latest offering, iPhone 16e on X.",20250220T074208
"Apple May Hike iPhone Prices By Nearly 9% To Counter Trump's Tariffs, Forecasts BoFa. Expects EPS Decline In 2026 - Bank of America  ( NYSE:BAC ) ","In response to the tariffs imposed by the Trump administration, Apple Inc. AAPL might have to raise iPhone prices by 9%, said analysts at the Bank of America.",20250220T065807
"iPhone 17 Pro May Finally Get Wireless Reverse Charging-Apple Reportedly Testing Power Sharing With AirPods, Apple Watch, And More - Apple  ( NASDAQ:AAPL ) ","Apple Inc. AAPL is reportedly testing a wireless reverse charging feature for its upcoming iPhone 17 Pro models, allowing the smartphone to power other devices. What Happened: A Weibo-based Chinese leaker, Instant Digital, said that Apple is experimenting with a 7.5W wireless charging capability, ...",20250220T051356
"Top Analyst Predicts Apple Will Hit $4 Trillion First Followed By Nvidia - Says AI Demand Is 'Exploding' Despite Tariffs And DeepSeek Fears: 'The Bears Can't See AI In The Spreadsheets...' - Apple  ( NASDAQ:AAPL ) , Amazon.com  ( NASDAQ:AMZN ) ","Wedbush analyst Dan Ives remains bullish on AI stocks, predicting Apple Inc. AAPL will be the first to reach a $4 trillion market cap, followed by Nvidia Corporation NVDA, despite concerns over tariffs and rising competition from China's DeepSeek.",20250220T024117
What's Behind the Surge in Chinese Tech Stocks & ETFs?,We discuss whether investors should consider investing in Chinese stocks now.,20250219T212000
