title,summary,time_published
Taiwan Semiconductor Eyes US Expansion Amid Push for Bigger Investments and Advanced Chip Production - Taiwan Semiconductor  ( NYSE:TSM ) ,"Taiwan promises to boost US trade and defense ties, addressing Trump's chip concerns as TSMC invests $65B in Arizona fabs. TSMC ramps up US expansion, spending $17.14B on advanced chips and packaging as Taiwan pushes for a global AI chip alliance.",20250214T131121
Should iShares S&P 500 Value ETF  ( IVE )  Be on Your Investing Radar?,Style Box ETF report for IVE ...,20250214T112006
"TikTok Returns To Apple And Google App Stores After A Month-Long Hiatus - Alphabet  ( NASDAQ:GOOG ) , Apple  ( NASDAQ:AAPL ) ","TikTok, the Chinese short video platform, has reappeared on the Apple and Google app stores following a month-long hiatus. What Happened: TikTok officially announced that the app was restored to the app stores of Apple Inc. AAPL and Alphabet Inc. GOOGL GOOG on Thursday evening.",20250214T110732
Here's How Generative AI Factors Into Amazon's Plan for Growth,"Amazon ( NASDAQ: AMZN ) ranks among the greatest growth stories in the stock market. Jeff Bezos founded the company in his garage in 1994 as an online bookseller. It's now the leader in e-commerce and cloud services. Amazon's share price has skyrocketed an astounding 234,700%, giving it a market ...",20250214T095200
"This Warren Buffett Index Fund Could Turn $400 Per Month Into $868,200","Warren Buffett is one of the most successful investors in U.S. history. Under his control, Berkshire Hathaway shares have returned about 20% annually since 1965. And brilliant investments engineered by Buffett played an important role in that shareholder value creation.Naturally, Buffett has ...",20250214T090000
"Zacks Investment Ideas feature highlights Alibaba, JD.com, Baidu, KWEB and Apple","Alibaba, JD.com, Baidu, KWEB and Apple have been highlighted in this Investment Ideas article.",20250214T070300
"Claudia Sheinbaum Says Mexican Government May Sue Google Over 'Gulf Of Mexico' Name Change - Alphabet  ( NASDAQ:GOOG ) , Apple  ( NASDAQ:AAPL ) ","Mexican President Claudia Sheinbaum said Thursday that her government may file a civil lawsuit against Alphabet Inc.'s GOOG GOOGL Google for labeling the Gulf of Mexico as the ""Gulf of America"" on its maps, following a controversial decree by U.S. President Donald Trump.",20250214T070154
"Apple, Tesla And Other MAG 7 Peers Too Expensive? Top Hedge Fund Challenges 'Overvaluation' Concerns - Apple  ( NASDAQ:AAPL ) , Amazon.com  ( NASDAQ:AMZN ) ","Top Hedge Fund Bridgewater Associates has questioned the widespread notion that the 'Magnificent Seven' stocks are overvalued, while the rest of the S&P 500 stocks are comparatively undervalued.",20250214T070102
"Tim Cook Confirms New Apple Product Launch Next Week, Elon Musk Sets Off Buzz By Sharing - Is It The iPhone SE 4? - Apple  ( NASDAQ:AAPL ) ","On Thursday, Apple Inc. AAPL CEO Tim Cook officially confirmed a new product launch on Feb. 19, fueling speculation that the company will unveil the iPhone SE 4. What Happened: Cook announced the launch via a post on X, formerly Twitter, using the hashtag #AppleLaunch, and said, ""Get ready to ...",20250214T050129
"Arm Takes On Its Own Customers - Poaches Talent, Competes With Qualcomm And Nvidia For AI And Data Center Chip Deals: Report - Apple  ( NASDAQ:AAPL ) , ARM Holdings  ( NASDAQ:ARM ) ","British chip designer Arm Holdings Plc ARM is reportedly entering the chip sales market, directly competing with its own clients, including Qualcomm Inc. QCOM and Nvidia Corporation NVDA, for AI and data center chip deals.",20250214T035117
Apple Stock Closes Above $240 After 36-Day Gap -Jim Cramer Mocks Early Sellers: '… Who Told Us It Was Over?' - Apple  ( NASDAQ:AAPL ) ,"Apple Inc. AAPL closed at $241.53 on Thursday, marking its first close above $240 in 36 days. This prompted Jim Cramer, the host of ""Mad Money,"" to take a jab at early sellers who doubted the stock's resilience.",20250214T025038
"Full-Shopping Boycotts Sweep Europe Over High Prices-Now, One US Community Is Following Suit But For A Different Cause - Apple  ( NASDAQ:AAPL ) , Costco Wholesale  ( NASDAQ:COST ) ","A wave of full-shopping boycotts has taken hold in parts of Europe, with consumers in the Balkans leading the charge against skyrocketing grocery prices. Now, a movement in the U.S. is adopting a similar strategy-but for an entirely different reason.",20250214T000043
Steve Jobs Feared His Porsche 911 Would Display His Wealth And Cost Him A $20 Million Deal-So He Scrambled To Hide It From Ross Perot - Apple  ( NASDAQ:AAPL ) ,"Steve Jobs was known for his obsession with perfection in the products he created and the cars he drove. His love for the Porsche 911 was legendary, and for years, he swapped his black Porsche for a new one every six months for a very Jobs-like reason - to avoid having a license plate.",20250213T213021
"Apple Is Back With Ads On X After Halting Platform Spending In 2023 Over Elon Musk's Posts - Apple  ( NASDAQ:AAPL ) , Amazon.com  ( NASDAQ:AMZN ) ","Apple is once again advertising on X after a 15-month break. The return to X advertising spending comes with Apple CEO Tim Cook attending Donald Trump's inauguration, where Elon Musk was. Get access to your new suite of high-powered trading tools, including real-time stock ratings, insider ...",20250213T171655
"Trump White House Bans AP Reporter Over 'Gulf Of America' Conflict: Is A First Amendment Court Case In The Works? - Alphabet  ( NASDAQ:GOOG ) , Apple  ( NASDAQ:AAPL ) ",The AP said it was blocked because it hadn't changed its stylebook entry for Gulf of Mexico to 'Gulf of America' as ordered by Trump. An AP exec said the agency will 'defend its constitutional rights' and the public's right to independent news coverage of their government.,20250213T171650
"Exploring The Competitive Space: Apple Versus Industry Peers In Technology Hardware, Storage & Peripherals - Apple  ( NASDAQ:AAPL ) ","In the fast-paced and cutthroat world of business, conducting thorough company analysis is essential for investors and industry experts. In this article, we will undertake a comprehensive industry comparison, evaluating Apple AAPL in comparison to its major competitors within the Technology ...",20250213T150049
"Ignore the Headlines, Buy Chinese Stocks","Despite concerns surrounding China's economy, a confluence of factors suggest a compelling bullish case for Chinese equities. Resilient price action, contrarian sentiment, government stimulus, attractive valuations, and rapid AI advancements create immense growth potential.",20250213T140000
"Apple's Next Big Bet? Tim Cook-Led Company Is 'Exploring' Humanoid As Well As Non-Humanoid Robots For Smart Home Future, Says Top Analyst Apple's Future Smart Home Ecosystem May Include Robots, Says Ming-Chi Kuo. 'Exploring both humanoid and non-humanoid - Tesla  ( NASDAQ:TSLA ) ","Apple Inc. AAPL is reportedly exploring the development of humanoid and non-humanoid robots for its future smart home ecosystem, according to a post by TF International Securities analyst Ming-Chi Kuo.",20250213T132556
"Not Just DeepSeek, China's AI Landscape Heats Up As Baidu Launches Free Ernie Bot - Baidu  ( NASDAQ:BIDU ) ","Baidu to launch Ernie 5.0 in late 2025 and offer Ernie Bot free to all users from April 1, intensifying China's AI competition. BIDU stock rises as Baidu expands AI offerings, slashes costs, and challenges rivals like Alibaba and OpenAI.",20250213T131912
Buy 3 Tech Mutual Funds for AI and Semiconductor Growth,"Invest in tech mutual funds like FSELX, KTCAX and PRSCX that focus on AI, cloud expansion and the semiconductor boom.",20250213T125200
Should Vanguard Russell 1000 Growth ETF  ( VONG )  Be on Your Investing Radar?,Style Box ETF report for VONG ...,20250213T112008
Should Schwab Fundamental U.S. Large Company ETF  ( FNDX )  Be on Your Investing Radar?,Style Box ETF report for ...,20250213T112006
"The Zacks Analyst Blog Apple, Microsoft, Alphabet and Amazon","Chicago, IL - February 13, 2025 - Zacks.com announces the list of stocks and ETFs featured in the Analyst Blog. Every day the Zacks Equity Research analysts discuss the latest news and events impacting stocks and the financial markets.",20250213T111100
Roughly 62% of U.S. Adults Hold Stocks. Those Who Don't Could Be Missing Out on Millions.,"The other 38% could still be applying investors' wealth-building strategy for themselves, even if they start on a smaller scale.",20250213T100700
"Apple Intelligence Rollout In China And Europe To Boost iPhone Sales, Says Deepwater's Gene Munster - Alibaba Gr Hldgs  ( NYSE:BABA ) , Apple  ( NASDAQ:AAPL ) ","Apple Inc. AAPL is set to introduce artificial intelligence ( AI ) features in China in collaboration with Alibaba Group Holdings BABA, a move that could potentially stimulate iPhone sales growth in the region, following a challenging period of declining sales.",20250213T065604
Softbank-Backed Arm Holdings 155% Post-IPO Surge Bolstered by AI Growth and Smartphone Integration - ARM Holdings  ( NASDAQ:ARM ) ,"Arm stock surged 157% since IPO, CEO sees AI as key to smartphone and PC market growth Arm targets 50% of Windows PC market, boosts AI role in OpenAI's $100B Stargate project Get real-time earnings alerts before the market moves and access expert analysis that uncovers hidden opportunities in ...",20250212T213543
Decoding Apple's Options Activity: What's the Big Picture? - Apple  ( NASDAQ:AAPL ) ,"Deep-pocketed investors have adopted a bullish approach towards Apple AAPL, and it's something market players shouldn't ignore. Our tracking of public options records at Benzinga unveiled this significant move today.",20250212T194535
"Why The MAGS ETF Has Remained Flat Year-to-Date Despite Some Strong Performers - Alphabet  ( NASDAQ:GOOGL ) , Apple  ( NASDAQ:AAPL ) ","Tesla, one of the seven stocks in MAGS, has been a major drag on the ETF's performance. Meanwhile, Meta has been a bright spot, driven by robust advertising revenue and more. Get real-time earnings alerts before the market moves and access expert analysis that uncovers hidden opportunities in ...",20250212T194209
"Apple Teams Up With Alibaba for AI, Analyst Says Edge Device Integration Could Boost Growth - Alibaba Gr Hldgs  ( NYSE:BABA ) , Apple  ( NASDAQ:AAPL ) ","Apple partners with Alibaba to develop AI features for China, submits for regulatory approval. Analyst sees Apple benefiting from AI on edge devices, eyes China market share recovery. Get real-time earnings alerts before the market moves and access expert analysis that uncovers hidden ...",20250212T175452
"Why Chinese Stocks Alibaba, Futu Holdings, and Tencent Shook Off Inflation Concerns and Are Rising Today","Despite a hotter-than-expected inflation report this morning, Chinese tech stocks shook off the bad news and marched higher. The beaten-down sector continues to advance since the emergence of China's DeepSeek artificial intelligence ( AI ) chatbot.Shares of the large search and e-commerce company ...",20250212T173257
Apple Down 7% Year to Date on iPhone Weakness: Buy or Hold the Stock?,"Although AAPL's AI push and growing Services business are positives, stretched valuation and China headwinds are concerning in 2025.",20250212T161100
"Market Analysis: Apple And Competitors In Technology Hardware, Storage & Peripherals Industry - Apple  ( NASDAQ:AAPL ) ","Amidst the fast-paced and highly competitive business environment of today, conducting comprehensive company analysis is essential for investors and industry enthusiasts.",20250212T150052
"Taiwan Semiconductor Under Pressure From Trump Tariff Threats, Could Push Advanced Packaging Capacity to US - Taiwan Semiconductor  ( NYSE:TSM ) ","Taiwan dispatches deputy economy minister to Washington as Trump threatens semiconductor tariffs Taiwan Semiconductor faces uncertainty as Trump eyes tariffs, US CHIPS Act subsidies at risk Get two weeks of free access to pro-level trading tools, including news alerts, scanners, and real-time ...",20250212T145051
"Company News for Feb 12, 2025","Companies in The News Are: AAPL, TSLA, KO, SHOP ...",20250212T142100
"Apple Finds Its AI Wingman In Alibaba - Can It Power An iPhone Comeback In China? - Alibaba Gr Hldgs  ( NYSE:BABA ) , Apple  ( NASDAQ:AAPL ) ","Apple partners with Alibaba to bring AI features to iPhones in China, boosting investor confidence. The AI rollout could drive an iPhone upgrade cycle, positioning Apple for a potential resurgence in China.",20250212T131407
Prediction: Warren Buffett and Berkshire Hathaway Sold $25 Billion in Apple Stock in Q4,"Apple ( NASDAQ: AAPL ) has been one of Warren Buffett and Berkshire Hathaway's ( NYSE: BRK.A ) ( NYSE: BRK.B ) most profitable and famous investments. However, they've been selling off their shares pretty methodically lately.Berkshire's Apple holding peaked in third-quarter 2023, when it held ...",20250212T122200
"Time To Trim Big Tech? This Analyst Says Reducing 'Mag 7' Exposure Is Now 'Prudent' This Analyst Gives Three Reasons To Trim ""Magnificent Seven"" Holdings. 'Lowering Exposure Is Prudent' - Apple  ( NASDAQ:AAPL ) , Amazon.com  ( NASDAQ:AMZN ) ","The CEO of Trivariate Research, Adam Parker, recommended investors reduce their exposure to the ""Magnificent Seven"" stocks amid high valuation and related risks. What Happened: ""Over the last several years we have maintained the view, that it was prudent for long-only U.S. equity managers to be ...",20250212T121914
Is iShares Core S&P U.S. Value ETF  ( IUSV )  a Strong ETF Right Now?,Smart Beta ETF report for ...,20250212T112007
Should Schwab U.S. Large-Cap Growth ETF  ( SCHG )  Be on Your Investing Radar?,Style Box ETF report for ...,20250212T112007
Should You Invest in the Fidelity MSCI Information Technology Index ETF  ( FTEC ) ?,Sector ETF report for ...,20250212T112005
"Warren Buffett Sells Apple Stock and Buys an Industry-Leading Stock Up 3,400% Since Its IPO","Warren Buffett oversees the vast majority of Berkshire Hathaway's equity holdings, while fellow investment managers Todd Combs and Ted Weschler handle a small percentage of the $299 billion portfolio. Berkshire doesn't disclose which trades are made by which person, but Buffett almost certainly ...",20250212T103000
Prediction: Warren Buffett's Stock-Selling Streak Will Extend to 9 Quarters,The Oracle of Omaha's short-term actions don't always align with his long-term approach.,20250212T095100
"Dow Gains Over 100 Points Following Powell Comments: Fear & Greed Index Remains In 'Neutral' Zone - Alibaba Gr Hldgs  ( NYSE:BABA ) , Apple  ( NASDAQ:AAPL ) ","The CNN Money Fear and Greed index showed almost no change in the overall market sentiment, with the index remaining in the ""Neutral"" zone on Tuesday. U.S. stocks settled mixed on Tuesday, as investors digested comments from Federal Reserve Chair Jerome Powell.",20250212T094134
Best Stock to Buy Right Now: Amazon vs Apple,"Amazon ( NASDAQ: AMZN ) and Apple ( NASDAQ: AAPL ) have become among the world's most recognized companies. They've also become very valuable, with the former's market cap exceeding $2.4 trillion and the latter's about $3.4 trillion.Both have been very successful and rewarding for shareholders ...",20250212T093200
"The Best Warren Buffett Stocks to Buy With $1,000 Right Now",The Oracle of Omaha's picks are universally sound enough to work in almost anyone else's portfolio as well.,20250212T091400
"Apple ID Switching No Longer Needed - Here's How To Migrate Your Apps, Music, Or Subscriptions","On Tuesday, Apple Inc. quietly rolled out a purchase migration feature, allowing users to consolidate purchases made on a secondary account into their primary one. What Happened: The change was detailed in a newly published support document, which outlines the exact process and requirements for ...",20250212T065419
"Trump White House Boasts Apple's 'Gulf Of Mexico' Rename, But Pinch To Zoom And You Might Be Surprised - Alphabet  ( NASDAQ:GOOG ) , Apple  ( NASDAQ:AAPL ) ","On Tuesday, Apple Inc. AAPL renamed the Gulf of Mexico to Gulf of America on its Maps app, following an executive order signed by U.S. President Donald Trump on his first day in office. What Happened: The U.S. government officially updated its maps to reflect the new name.",20250212T053031
Apple's AI Split: Chooses Alibaba For China And OpenAI For Everyone Else - Alibaba Gr Hldgs  ( NYSE:BABA ) ,Apple teams up with Alibaba to bring AI features to iPhones in China as it fights to regain lost market share Apple submits AI features co-developed with Alibaba for China's approval after Baidu partnership falls through,20250211T165714
"Apple Vs IBIT Bitcoin ETF: One Is Warren Buffett's Berkshire Hathaway's Biggest Holding, The Other Gives Exposure To A Crypto He Vehemently Dislikes, Which Has Generated Better Yearly Returns?","Berkshire Hathaway Chairman Warren Buffett has been a legendary figure in investment circles for over half a century, and his stock picks are keenly watched by both experienced and rookie players.",20250211T120044
Should WisdomTree U.S. LargeCap Dividend ETF  ( DLN )  Be on Your Investing Radar?,Style Box ETF report for ...,20250211T112007
Grab These 3 Large-Cap Blend Mutual Funds for Higher Returns,"Below, we share with you three large-cap blend mutual funds, viz., FDESX, VQNPX and DFUEX. Each has earned a Zacks Mutual Fund #1 Rank.",20250211T094900
Best Stock to Buy Right Now: Nike vs. Apple,Which of these iconic American brands has a brighter future?,20250211T093000
Here Is My Top Artificial Intelligence  ( AI )  Stock to Buy Right Now,"As most informed artificial intelligence ( AI ) stock investors know, not all of these investments are multibaggers. In fact, some have struggled to outperform the S&P 500 during specified time periods.Such has been the case with prominent semiconductor stock Qualcomm ( NASDAQ: QCOM ) .",20250211T090700
Apple Watch Dominance Under New Threat As Huawei Registers Smartwatch As Medical Device - Apple  ( NASDAQ:AAPL ) ,"Huawei Technologies has found an unconventional way to boost smartwatch sales in China-by registering them as medical devices. What Happened: Huawei's Watch D2, launched in November, has gained traction in China after consumers realized they could charge it to their medical insurance accounts, ...",20250211T072809
"Apple's Super Bowl LIX Strategy 'Discretely Genius,' Says YouTuber Nikias Molina-Here's How Cupertino Stole The Spotlight Without Pushing An iPhone In Your Face - Apple  ( NASDAQ:AAPL ) ","Apple Inc. AAPL played a major role in Super Bowl LIX without overtly advertising its products, a move that YouTuber and reviewer Nikias Molina called ""discretely genius."" What Happened: On Monday, in a series of posts on X, formerly Twitter, Molina said that Apple focused on culture, music, and ...",20250211T042437
iOS 18.3.1 Released With Critical Security Fix: Apple Confirms USB Restricted Mode Vulnerability Was Actively Exploited - Apple  ( NASDAQ:AAPL ) ,"On Monday, Apple Inc. AAPL rolled out iOS 18.3.1 and iPadOS 18.3.1 updates. What Happened: The updates address a vulnerability that could disable USB Restricted Mode on locked devices, said Apple. The flaw, which required physical access to the device, was reportedly exploited in sophisticated ...",20250211T021642
Apple Is TSMC's Largest Customer; Their Business Love Story Started Over Chinese Food - But Will Their Relationship Change Dramatically in 2025? - Apple  ( NASDAQ:AAPL ) ,A surprise dinner at Morris Chang's home in 2010 set the stage for one of the most consequential business relationships in the tech industry-one that made Apple Inc. AAPL the biggest client of Taiwan Semiconductor Manufacturing Ltd. TSMC.,20250211T010116
"Behind Marvell Tech's Multi-Fold Growth: R&D, Acquisitions And AI Infrastructure - Marvell Tech  ( NASDAQ:MRVL ) ","Marvell stock surged 340% in five years as AI-driven demand boosts its semiconductor solutions across data centers and networking. Analysts see Marvell exceeding its $2.5B AI revenue target in 2025, fueled by ASIC deals with Amazon, Google, and AI networking growth.",20250210T231025
Taiwan Semiconductor's Trillion-Dollar Valuation: The Chipmaker Enabling AI Boom - Taiwan Semiconductor  ( NYSE:TSM ) ,"Taiwan Semiconductor's AI chip demand, 1nm expansion, and U.S. growth drive stock gains. Goldman Sachs sees Taiwan Semiconductor's AI leadership and price hikes boosting margins beyond 59%. NOW OPEN: 200 Charter Memberships to Benzinga Trade Alerts",20250210T211548
"5 Stocks to Sell on the New China Trade War - Apple  ( NASDAQ:AAPL ) , Hasbro  ( NASDAQ:HAS ) ","In a trade war with China, tariffs are charged to importers and passed on to consumers. Next: Access Our New, Shockingly Simple 'Alert System' The ""tariff man"" is back, with President Donald Trump renewing his trade war impulses. So far he's threatened tariffs on Canada, Mexico, China, on all ...",20250210T204124
"China Sets Sights On Apple, Nvidia And Other US Tech Companies As Trade Tensions Rise - Apple  ( NASDAQ:AAPL ) , Broadcom  ( NASDAQ:AVGO ) ","Chinese officials are building a list of U.S. tech companies that can be probed over antitrust concerns. China is reportedly looking to target U.S. tech companies in order to gain leverage in trade negotiations with the U.S. Next: Access Our New, Shockingly Simple 'Alert System'",20250210T171447
"Comparing Apple With Industry Competitors In Technology Hardware, Storage & Peripherals Industry - Apple  ( NASDAQ:AAPL ) ","Amidst the fast-paced and highly competitive business environment of today, conducting comprehensive company analysis is essential for investors and industry enthusiasts.",20250210T150034
Don't Overlook Apple  ( AAPL )  International Revenue Trends While Assessing the Stock,Explore Apple's (AAPL) international revenue trends and how these numbers impact Wall Street's forecasts and what's ahead for the stock.,20250210T141523
"Music Licensing, Inc. Receives Official Federal Recognition of Its Wholly Owned Subsidiary, Pro Music Rights, as a Performing Rights Organization in the United States Federal Register","Naples, FL, Feb. 10, 2025 ( GLOBE NEWSWIRE ) -- Music Licensing, Inc. ( OTC: SONG ) ( OTC: SONGD ) , a leader in the music rights and intellectual property sector, is pleased to announce that its wholly owned subsidiary, Pro Music Rights ( PMR ) , has been officially recognized in the Federal ...",20250210T130000
"This Company Owns a Big Chunk of the ""Magnificent Seven"" -- and Wall Street Thinks Its Stock Is a Screaming Buy","Who owns the biggest companies in the country? Millions of shareholders. However, a handful of giant institutional investors own the largest stakes.BlackRock ( NYSE: BLK ) ranks near the top of the list of those huge institutional investors.",20250210T104700
Prediction: These 2 Vanguard ETFs Will Trounce the S&P 500 This Year,"Many Wall Street analysts think the S&P 500 will rise for the third consecutive year in 2025. Projections vary, but the consensus forecast appears to be that the index could jump in the ballpark of 10%. The S&P is roughly one-third of the way to hitting that mark already.",20250210T104400
Buy 2 Alger Mutual Funds for Strong Returns,Invest in Alger mutual funds like ALGRX and ALBAX for strong long-term growth potential.,20250210T101500
The Stock Market Has an Earnings Quality Problem -- and It Can't Be Ignored Any Longer,A dollar in corporate profit isn't always what it's cracked up to be.,20250210T095100
"Apple Ramping Up Hiring For Home Robotics Team, Says Top Analyst: What's Brewing? - Apple  ( NASDAQ:AAPL ) ","Apple Inc. AAPL is reportedly ramping up its recruitment efforts for its home robotics division. What Happened: In his latest weekly ""Power On"" newsletter, Bloomberg columnist Mark Gurman said that the company has posted several job listings for robotics specialists over the past few weeks.",20250210T034305
Apple Watch Users Are Strapping Them To Their Ankles - Here's Why Its Leaving Some People Bewildered - Apple  ( NASDAQ:AAPL ) ,"A new trend has emerged among Apple Inc. AAPL Watch users, who are now wearing the device on their ankles. What Happened: Fitness enthusiasts like Ana Espinal have adopted this practice to improve heart rate monitoring, especially for those with smaller wrists, reported the New York Times.",20250210T023855
"Elon Musk's SpaceX And T-Mobile Go Live With Starlink-Powered Satellite-To-Cell Service: Here's How Much It Will Cost - Apple  ( NASDAQ:AAPL ) , AT&T  ( NYSE:T ) ","On Sunday, T-Mobile U.S. Inc. TMUS offered free access to its satellite-to-cell beta service, powered by SpaceX's Starlink, for all users. What Happened: According to T-Mobile, 500,000 square miles of the U.S., previously unreachable by terrestrial towers, can now maintain connectivity.",20250210T012130
Apple's Revamped iPhone SE To Kickstart Pivotal Year Amid Challenges - Apple  ( NASDAQ:AAPL ) ,"Apple gears up for a pivotal year with a redesigned iPhone SE aiming to recapture market share. New iPhone SE set to boast a larger screen and Apple's in-house cellular modem at a competitive price point. Next: Access Our New, Shockingly Simple 'Alert System' Apple Inc.",20250209T202017
Prediction: This Unstoppable Vanguard ETF Could Smash the S&P 500 in 2025,"The S&P 500 ( SNPINDEX: ^GSPC ) has performed remarkably well in recent years, soaring by around 23% in 2024 alone and by more than 80% over the past five years.But as strong as those figures are, plenty of stocks and funds have crushed the S&P 500 lately.There's no way to know for certain how ...",20250209T170000
